Topic Names,Topic Urls,Topic Description,Followers,Active,Created Date
warriors,https://www.reddit.com/r/warriors/,For all things Golden State Warriors.,359k,896,"Jun 6, 2010"
snowboarding,https://www.reddit.com/r/snowboarding/,"All things snowboarding, /r/snowboarding or ""shreddit"" is the home for shredders of all age, cultures, and abilities.",1.3m,577,"May 22, 2008"
nrl,https://www.reddit.com/r/nrl/,National Rugby League - All things Rugby League! Weekly Round discussions about NRL games and other stuff and things.,75.4k,117,"Oct 6, 2008"
Braves,https://www.reddit.com/r/Braves/,Community to discuss the latest developments in Atlanta Braves baseball.,80.1k,105,"Aug 11, 2010"
CollegeBasketball,https://www.reddit.com/r/CollegeBasketball/,Your home for College Basketball on the internet. Forever.,1.6m,721,"Feb 22, 2010"
Cardinals,https://www.reddit.com/r/Cardinals/,Saint Louis Cardinals Baseball!,54.9k,32,"Sep 22, 2009"
bikecommuting,https://www.reddit.com/r/bikecommuting/,"A community of bicycle commuters.  Offering support, help and guidance to new commuters and advice and helpful tools for those who have been commuting for awhile.  Break free from the tedious traffic and enjoy the fresh air!",119k,111,"Jan 6, 2012"
CHIBears,https://www.reddit.com/r/CHIBears/,Bear Down,148k,1.0k,"Aug 12, 2010"
ravens,https://www.reddit.com/r/ravens/,Ball So Hard University - School of Truzz,129k,534,"Aug 20, 2010"
coys,https://www.reddit.com/r/coys/,A sub for the club that Bill Nicholson made,99.8k,1.3k,"Jul 25, 2010"
Mavericks,https://www.reddit.com/r/Mavericks/,Subreddit about the NBA team Dallas Mavericks.,158k,551,"Oct 10, 2010"
nyjets,https://www.reddit.com/r/nyjets/,Home of the New York Jets on Reddit,91.6k,372,"Aug 24, 2010"
nbadiscussion,https://www.reddit.com/r/nbadiscussion/,For high-quality NBA discussion.,143k,630,"Feb 29, 2016"
chelseafc,https://www.reddit.com/r/chelseafc/,r/ChelseaFC is the digital home of all things related to Chelsea Football Club.,248k,1.3k,"May 27, 2010"
bostonceltics,https://www.reddit.com/r/bostonceltics/,****The community for the 17-time NBA Champion Boston Celtics!,271k,559,"Sep 16, 2008"
Fishing,https://www.reddit.com/r/Fishing/,Fishing related news and personal stories.,992k,430,"Aug 29, 2008"
NYKnicks,https://www.reddit.com/r/NYKnicks/,Reddit's home of the New York Knicks,133k,378,"Jun 18, 2010"
LosAngelesRams,https://www.reddit.com/r/LosAngelesRams/,A community for fans of the Los Angeles Rams. Whose house? RAMS' HOUSE.,406k,214,"Jan 27, 2010"
steelers,https://www.reddit.com/r/steelers/,"The Official Subreddit of the Pittsburgh Steelers football team. Discussions about the latest team news, players, highlights, and more!",168k,637,"Aug 17, 2009"
nhl,https://www.reddit.com/r/nhl/,"The official subreddit of the National Hockey League! News, results, pictures, videos and discussion from around the league.",277k,209,"Jan 20, 2009"
FixedGearBicycle,https://www.reddit.com/r/FixedGearBicycle/,/r/FixedGearBicycle is a community dedicated to sharing content surrounding the world of fixed gear bicycles,77.8k,199,"Nov 6, 2008"
longboarding,https://www.reddit.com/r/longboarding/,"For longboarders, by longboarders. Ask your questions in the Daily General Thread.",215k,88,"Mar 25, 2009"
hockeyjerseys,https://www.reddit.com/r/hockeyjerseys/,The subreddit for hockey jersey fanatics!,56.6k,218,"Apr 10, 2012"
fantasybaseball,https://www.reddit.com/r/fantasybaseball/,"If you're looking for advice or want to talk about your team/league use the stickied threads. Post a text thread to share information, data, or analysis on a general fantasy baseball topic. Value is relative, include context when asking for advice.",126k,87,"Mar 15, 2009"
Barca,https://www.reddit.com/r/Barca/,FC Barcelona News and Discussion,101k,538,"Oct 12, 2010"
denvernuggets,https://www.reddit.com/r/denvernuggets/,The #1 Denver Nuggets Community,123k,200,"Mar 29, 2011"
realmadrid,https://www.reddit.com/r/realmadrid/,The home of Real Madrid on Reddit.,102k,323,"May 12, 2010"
suns,https://www.reddit.com/r/suns/,Official Subreddit of your Phoenix Suns!,132k,409,"Oct 18, 2011"
MkeBucks,https://www.reddit.com/r/MkeBucks/,"A community for Milwaukee Bucks discussion, news and deer friends!",153k,280,"Oct 25, 2011"
NBASpurs,https://www.reddit.com/r/NBASpurs/,Welcome to NBASpurs,122k,239,"Oct 10, 2010"
tampabayrays,https://www.reddit.com/r/tampabayrays/,News and discussion about your Tampa Bay Rays!,30.5k,116,"Aug 25, 2010"
peloton,https://www.reddit.com/r/peloton/,"Peloton is the community for professional road cycling. Share links, news, results, transfer rumours & other road cycling tidbits related to the teams, events and riders in the World Tour.",86.7k,294,"Sep 11, 2011"
AtlantaUnited,https://www.reddit.com/r/AtlantaUnited/,All Things Atlanta United!,30.5k,131,"Jun 25, 2015"
BostonBruins,https://www.reddit.com/r/BostonBruins/,Home to the largest Boston Bruins fan base.,66.3k,222,"Mar 31, 2010"
minnesotatwins,https://www.reddit.com/r/minnesotatwins/,"The Minnesota Twins are a professional baseball team based in Minneapolis, Minnesota. They are a member of the Central Division of Major League Baseball's American League.",44.4k,25,"Sep 28, 2010"
SanJoseSharks,https://www.reddit.com/r/SanJoseSharks/,"For all things black and teal.  Unofficial Official Subreddit of the San Jose Sharks.
2021 Banner by /u/HelpIThinkImASoup",50.2k,66,"Nov 29, 2009"
Torontobluejays,https://www.reddit.com/r/Torontobluejays/,"Home to Canada's Baseball Team, the Toronto Blue Jays.",85.2k,159,"Feb 4, 2011"
ripcity,https://www.reddit.com/r/ripcity/,"A place for fans of the NBA basketball team, The Portland Trail Blazers",136k,293,"Jun 1, 2010"
stlouisblues,https://www.reddit.com/r/stlouisblues/,The unofficial subreddit of the 2019 Stanley Cup Champion St. Louis Blues,43.6k,139,"Mar 22, 2010"
flyfishing,https://www.reddit.com/r/flyfishing/,"This is a subreddit for anglers who pursue, or wish to pursue, their favorite fish on fly rods.  Whether you fly fish a 2wt on small creeks for brook trout, a 14' 9wt for Steelhead or Atlantic Salmon, or Tarpon on a 12wt; your contributions and questions will be welcomed and appreciated!",133k,97,"Nov 10, 2008"
MCFC,https://www.reddit.com/r/MCFC/,A subreddit for fans of Manchester City Football Club. Come hang out and discuss all things City.,92.9k,277,"Aug 14, 2010"
balisong,https://www.reddit.com/r/balisong/,"**Welcome to /r/balisong! This is a community for balisong flippers, collectors, and anyone who is interested in the art/sport of butterfly knives. Feel free to post pictures of your collection, videos of you flipping, and any thoughts or opinions you have. If you have any questions, please use the question thread and to always read the rules before posting!

[The /r/balisong Community Video](https://www.youtube.com/watch?v=5pvPXa6g3j4)",63.3k,204,"Jan 2, 2013"
redsox,https://www.reddit.com/r/redsox/,"A place for Red Sox fans to discuss their favorite team. Whether you're from New England or beyond, all are welcome.",116k,129,"Feb 6, 2008"
LigaMX,https://www.reddit.com/r/LigaMX/,"English/Spanish-language coverage of Mexican Soccer (Liga MX, National Team, Liga de Ascenso, Women's, Futsal, Beach Soccer, etc) and Mexican players abroad.",31.7k,164,"Jul 9, 2012"
phillies,https://www.reddit.com/r/phillies/,The official subreddit of the Philadelphia Phillies!,60.6k,50,"Jul 1, 2008"
NewYorkMets,https://www.reddit.com/r/NewYorkMets/,Home of the New York Mets on reddit.,56.4k,174,"Dec 8, 2010"
CHICubs,https://www.reddit.com/r/CHICubs/,"A place for Cubs fans to talk about the team we love.

Recommend opting out of the reddit redesign when viewing this sub!",64.8k,39,"Mar 26, 2015"
SFGiants,https://www.reddit.com/r/SFGiants/,Welcome to SFGiants,61.9k,208,"Oct 30, 2010"
ACMilan,https://www.reddit.com/r/ACMilan/,Milano Siamo Noi,29.8k,586,"Apr 8, 2010"
Naruto,https://www.reddit.com/r/Naruto/,Everything related to the Naruto and Boruto series goes here. Although you could also talk about the topping too.,850k,2.0k,"Mar 13, 2009"
BokuNoHeroAcademia,https://www.reddit.com/r/BokuNoHeroAcademia/,"Welcome to r/BokuNoHeroAcademia, a subreddit dedicated to Kohei Horikoshi's manga and anime series ""My Hero Academia"".",963k,1.1k,"Oct 29, 2014"
marvelstudios,https://www.reddit.com/r/marvelstudios/,A subreddit dedicated to the Marvel Cinematic Universe!,2.2m,9.6k,"Jul 14, 2012"
rupaulsdragrace,https://www.reddit.com/r/rupaulsdragrace/,"Do you have what it takes? Only those with Charisma, Uniqueness, Nerve and Talent will make it to the top! Start your engines...and may the best drag queen win! Dedicated to everyone's favorite drag queen tv show.",464k,1.9k,"Nov 15, 2011"
90DayFiance,https://www.reddit.com/r/90DayFiance/,"90 Day Fiance: come to learn about the K1 visa process, stay to be frauded by TLC. New episodes every Sunday at 8pm EDT.",291k,1.1k,"Nov 11, 2014"
dbz,https://www.reddit.com/r/dbz/,"A subreddit for all things Dragon Ball!

discord.gg/dbz",516k,843,"Mar 21, 2011"
Boruto,https://www.reddit.com/r/Boruto/,Subreddit about Boruto: Naruto Next Generations,171k,692,"Nov 5, 2014"
rickandmorty,https://www.reddit.com/r/rickandmorty/,"This is the subreddit for fans of Dan Harmon & Justin Roiland's animated series, Rick and Morty.",2.5m,901,"May 19, 2012"
howardstern,https://www.reddit.com/r/howardstern/,We discuss anything related to Howard Stern.,78.2k,577,"Oct 29, 2008"
cordcutters,https://www.reddit.com/r/cordcutters/,"Are you tired of paying too much for cable television? Join us and become a cordcutter today. We offer advice on live streaming and on demand services, antennas, and OTA DVRs. Get help with your Smart TV, Roku, Fire TV, Apple TV, Chromecast, and Android TV. Discuss Netflix, Hulu, and Amazon. Learn about Sling TV, Disney+, FuboTV, DirecTV Now, YouTube TV and Philo.",365k,299,"Jan 19, 2011"
TheLastAirbender,https://www.reddit.com/r/TheLastAirbender/,"The subreddit for fans of Avatar: The Last Airbender, The Legend of Korra, the comics, the upcoming Avatar Studios animated movie and other projects, novels, games, and all other Avatar content.",1.1m,1.4k,"Jul 21, 2010"
IASIP,https://www.reddit.com/r/IASIP/,"A sub-reddit for the fans and critics of the show It's Always Sunny In Philadelphia. Discussion of the show, pictures from the show and anything else.",695k,1.9k,"Aug 24, 2010"
Animesuggest,https://www.reddit.com/r/Animesuggest/,"Suggest an anime, manga, light novel, or visual novel that you've seen and loved, or ask about what to watch, read, or play next!",442k,581,"Aug 27, 2011"
stevenuniverse,https://www.reddit.com/r/stevenuniverse/,The number 1 subreddit for Steven Universe. Come and obsess over gay space rocks with us.,312k,623,"Nov 11, 2012"
brooklynninenine,https://www.reddit.com/r/brooklynninenine/,"Subreddit for Brooklyn Nine-Nine, the now NBC TV show that stars Andy Samberg and Andre Braugher.",675k,905,"May 11, 2013"
thebachelor,https://www.reddit.com/r/thebachelor/,"r/thebachelor is a subreddit dedicated to thoughtful discussion about The Bachelor franchise, the lives of contestants, and how Bachelor Nation interacts with and influences the world around us.",184k,1.9k,"Feb 10, 2012"
TheSimpsons,https://www.reddit.com/r/TheSimpsons/,"Simpsons TV Show. The /r/TheSimpsons subreddit is fan base of redditors who love The Simpsons. 

The Simpsons is an American animated sitcom created by Matt Groening for the Fox Broadcasting Company. The show is set in the fictional town of Springfield and parodies American culture, society and television.",404k,664,"Feb 8, 2010"
ShingekiNoKyojin,https://www.reddit.com/r/ShingekiNoKyojin/,"A subreddit for fans of the anime/manga ""Attack on Titan"" (known as ""Shingeki no Kyojin"" in Japan), by Hajime Isayama.",733k,1.0k,"Feb 18, 2013"
thewalkingdead,https://www.reddit.com/r/thewalkingdead/,Subreddit for all things The Walking Dead.,1.5m,481,"Jul 22, 2010"
MtvChallenge,https://www.reddit.com/r/MtvChallenge/,"Welcome to the official rMTVChallenge! The sub for the greatest reality TV competition show, MTV's The Challenge! We are a spoiler free sub, please make sure to take a look at our rules before posting. 

Join us for live and post-episode discussions, weekly megathreads, and great original content! Threads with the 💣🌋 emojis are open to all spoilers from yet-to-be aired seasons, including season winner(s). If you are Unspoiled, avoid those threads and the mods will play defense everywhere else.",87.4k,631,"Jun 30, 2014"
asoiaf,https://www.reddit.com/r/asoiaf/,"News and discussions relating to George R. R. Martin's ""A Song of Ice and Fire"" novels, his Westeros-based short stories, the ""Game of Thrones"" TV series, and all things ASOIAF - but with particular emphasis on the written series.",710k,778,"Jul 18, 2009"
StrangerThings,https://www.reddit.com/r/StrangerThings/,"Sub for the Netflix Original series: Stranger Things.

The disappearance of a young boy sparks a chain of events leading the residents of the small town of Hawkins to uncover a government conspiracy and a supernatural mystery which will not only shatter all semblance of normality, but also threaten their very existence.",601k,185,"Oct 17, 2015"
survivor,https://www.reddit.com/r/survivor/,,,,
thesopranos,https://www.reddit.com/r/thesopranos/,"Reddit community dedicated to the HBO hit TV series, The Sopranos, and movie, The Many Saints of Newark.",146k,1.2k,"Mar 8, 2011"
batman,https://www.reddit.com/r/batman/,The Dark Knight.  The Caped Crusader.  The World's Greatest Detective.  Ol' Pointy Ears.  A place to discuss the batman and all things batman related.,401k,486,"Jan 3, 2009"
BravoRealHousewives,https://www.reddit.com/r/BravoRealHousewives/,"Discuss all the Real Housewives franchises by Bravo TV with us! You are in the right place for: 

Real Housewives of Atlanta | Beverly Hills | New Jersey | New York City | Orange County | Melbourne | Miami | Toronto | Vancouver | Potomac | Dallas | Salt Lake City | Vanderpump Rules | Summer House | Southern Charm | Below Deck | Ladies of London | Mob Wives and more!",163k,1.9k,"Oct 1, 2012"
blackmirror,https://www.reddit.com/r/blackmirror/,Black Mirror on Netflix,330k,96,"Sep 9, 2012"
NetflixBestOf,https://www.reddit.com/r/NetflixBestOf/,"The primary purpose of /r/NetflixBestOf is to shitpost about Breaking Bad.  Reposts are not only allowed, but are encouraged to some extent. The front page of this subreddit is meant to be a living representation of quality content on Netflix and you might see the same submissions multiple times. The mods are leaving it up to the community to utilize downvotes if they feel that reposts are too excessive.

We do not link to other subreddits",2.9m,340,"Apr 12, 2010"
Berserk,https://www.reddit.com/r/Berserk/,For fans of the manga Berserk and its adaptations.,286k,727,"May 19, 2010"
BlackClover,https://www.reddit.com/r/BlackClover/,For discussing the manga and anime series Black Clover by Yuki Tabata.,203k,492,"Feb 16, 2015"
freefolk,https://www.reddit.com/r/freefolk/,Welcome to freefolk,1.1m,1.2k,"Apr 13, 2015"
gameofthrones,https://www.reddit.com/r/gameofthrones/,"This is a place to enjoy and discuss the HBO series, book series ASOIAF, and GRRM works in general. It is a safe place regardless of where you are in the story. We have three main rules. Content must be relevant. Spoilers must have warning. Be legal and respectful to others.

Post spoiler tags are: [No Spoilers], [Spoilers], or [Leaks]

Posts outside the content scope are removed. Redditors unable to follow the [sub's rules](http://www.reddit.com/r/gameofthrones/w/posting_policy) are banned.",2.9m,878,"Mar 2, 2010"
riverdale,https://www.reddit.com/r/riverdale/,"Riverdale is a television series for The CW/Netflix, based on characters from Archie Comics. 

Set in the present, the series offers a bold, subversive take on Archie, Jughead, Betty, Veronica and their friends, exploring the surreality of small-town life — the darkness and weirdness bubbling beneath Riverdale’s wholesome façade.",107k,117,"Apr 29, 2012"
RWBY,https://www.reddit.com/r/RWBY/,RWBY: A Rooster Teeth Production (Pronounced Ruby),158k,554,"Nov 6, 2012"
BoJackHorseman,https://www.reddit.com/r/BoJackHorseman/,"Subreddit for the Netflix animated series, BoJack Horseman, starring BoJack Horseman as BoJack Horseman.",450k,726,"Jan 27, 2014"
lucifer,https://www.reddit.com/r/lucifer/,Subreddit for the Netflix drama *Lucifer* based on the DC/Vertigo comics,148k,169,"Feb 13, 2011"
TheBlackList,https://www.reddit.com/r/TheBlackList/,"Subreddit for The Blacklist, the TV show currently airing on NBC.

For decades, ex-government agent Raymond Reddington (James Spader) has been one of the FBI's most wanted. Brokering deals for criminals across the globe, Red was known as ""The Concierge of Crime"".

Now, he's surrendered to the FBI with an offer: He will help catch a ""blacklist"" of mobsters, spies and terrorists under the condition that he speaks only to Elizabeth Keen (Megan Boone), an FBI profiler fresh out of Quantico.",45.2k,224,"Feb 27, 2013"
TeenMomOGandTeenMom2,https://www.reddit.com/r/TeenMomOGandTeenMom2/,Your destination for gossip and discussion about all things related to the Teen Mom and 16 and Pregnant franchise.,106k,1.4k,"Aug 19, 2017"
startrek,https://www.reddit.com/r/startrek/,"Star Trek news and discussion. No slash fic.


...maybe a little slash fic.",303k,616,"Jun 17, 2008"
Glitch_in_the_Matrix,https://www.reddit.com/r/Glitch_in_the_Matrix/,"""Eye-witness event(s) that cannot be explained with critical thinking."" **Please read forum rules before posting**",871k,347,"Jan 13, 2012"
overlord,https://www.reddit.com/r/overlord/,"Overlord Anime/Manga/Novel Discussion.

Spoilers for Anime-Onlys.",171k,625,"Apr 10, 2012"
bleach,https://www.reddit.com/r/bleach/,A reddit for the Bleach manga & anime and the spinoff Burn the Witch created by Tite Kubo. Join us on Discord: https://discord.gg/soul-society,178k,1.2k,"Mar 5, 2010"
greysanatomy,https://www.reddit.com/r/greysanatomy/,The subreddit for all your Grey's Anatomy and Private Practice Discussion! The show was created by Shonda Rhimes and it premiered in 2005 by ABC.,134k,466,"Nov 8, 2011"
trailerparkboys,https://www.reddit.com/r/trailerparkboys/,"Here we 'reddit' about the Trailer Park Boys which is a documentary-style comedy about the inhabitants of Sunnyvale Trailer Park, located in the beautiful Maritime province of Nova Scotia, Canada. The show follows the exploits of Sunnyvale's most notorious residents, Ricky, Julian, and Bubbles, as they attempt to make money through various greasy (and mostly illegal) get-rich-quick schemes, hotly pursued by the park's drunken supervisor, Jim Lahey, and his shirtless sidekick, Randy.",208k,285,"Oct 29, 2009"
FlashTV,https://www.reddit.com/r/FlashTV/,"Welcome to r/FlashTV, a subreddit about the comic-book TV series starring Grant Gustin. Discuss anything and everything about the show here.   Airs Tuesdays at 8 PM EST on The CW!",159k,304,"Aug 12, 2013"
BigBrother,https://www.reddit.com/r/BigBrother/,Reddit's source for discussion of your favorite houseguests,167k,338,"Aug 17, 2009"
PandR,https://www.reddit.com/r/PandR/,"A subreddit for the fans of the show Parks and Recreation. Discussion of the show, pictures from the show and anything else Parks and Recreation-related.",602k,709,"Jan 20, 2011"
community,https://www.reddit.com/r/community/,"Welcome to a community of Community fans, and the subreddit that's streets ahead! 

Voted 5th best new Reddit community of 2010 and 2nd best little Reddit community of 2011!",521k,568,"Mar 2, 2009"
adventuretime,https://www.reddit.com/r/adventuretime/,"Subreddit dedicated to Cartoon Networks hit show, Adventure Time!",356k,557,"Oct 11, 2010"
Konosuba,https://www.reddit.com/r/Konosuba/,"The subreddit for Kono Subarashii Sekai ni Shukufuku wo!, also known as Konosuba!

Also the anime where everyone is useless goddess",280k,479,"Jan 21, 2016"
arrow,https://www.reddit.com/r/arrow/,"Welcome to r/arrow, a subreddit about the comic-book TV series starring Stephen Amell. Discuss anything and everything about the show here.",114k,205,"May 19, 2012"
fairytail,https://www.reddit.com/r/fairytail/,"Fairy Tail is a whimsical and adventurous anime, full of Wizards, Dragons, and Talking cats!  This epic series takes us through all the dangers that the members of fairy tail face and eventually overcome through mutual love and friendship. Through Arcs of all kinds Fairy Tail sticks together and learn more about their guild members past!",112k,244,"Jan 16, 2011"
Spiderman,https://www.reddit.com/r/Spiderman/,A subreddit for all things related to our friendly neighbourhood hero.,373k,4.6k,"Jul 2, 2010"
touhou,https://www.reddit.com/r/touhou/,Girls are now preparing. Please wait warmly and have some tea. Touhou is a series of Danmaku shooters that has amassed a surprisingly active and committed fan following. This subreddit is devoted to sharing the wonderful Touhou series with the Reddit community.,98.6k,590,"Mar 25, 2009"
doctorwho,https://www.reddit.com/r/doctorwho/,"Reddit's Doctor Who Fan Community - News, Discussion, Artwork and Fan Creations!",452k,353,"Mar 12, 2008"
seinfeld,https://www.reddit.com/r/seinfeld/,"Hellllloooooooo! A reddit all about Jerry, George, Elaine and Kramer. Don't forget Uncle Leo!!

**Update 11/13/20:** **Now with MORE Flair!**",228k,766,"Feb 13, 2009"
the100,https://www.reddit.com/r/the100/,Welcome to The100,81.5k,273,"May 6, 2013"
scifi,https://www.reddit.com/r/scifi/,"Science Fiction, or Speculative Fiction if you prefer. Fantasy too.  Asimov, Bradbury, Clarke, Dick, Heinlein and other SF books.  SF movies and TV shows.  Fantasy stuff like Tolkien and Game of Thrones.  Laser guns, space ships, and time travel.  etc.   Star Trek, Battlestar, Star Wars, etc.",2.7m,358,"Jan 25, 2008"
futurama,https://www.reddit.com/r/futurama/,"Welcome to the wooorld of tomorrowww!

Have you ever tried simply closing out of reddit, sitting down with your children, and hitting them?",703k,343,"Apr 4, 2008"
disney,https://www.reddit.com/r/disney/,"This unofficial subreddit is dedicated to the stories, worlds, and magic of all things Disney! From movies, theme parks, games, music, shopping, and more, find your MAGIC with r/Disney!",732k,149,"Jan 26, 2008"
titanfolk,https://www.reddit.com/r/titanfolk/,"(the worst) MANGA SPOILERS SUBREDDIT! (in the whole world)

P.S. Not toxic at all, only 3.6 roentgen",237k,881,"May 1, 2018"
TheHandmaidsTale,https://www.reddit.com/r/TheHandmaidsTale/,"This subreddit is a place to discuss The Handmaid's Tale TV series, based on Margaret Atwood's novel of the same name. Blessed be the fruit.",131k,168,"Jul 16, 2016"
criterion,https://www.reddit.com/r/criterion/,The Criterion Collection is a continuing series of important classic and contemporary films on home video.,119k,460,"Jan 18, 2011"
westworld,https://www.reddit.com/r/westworld/,Subreddit for the HBO series Westworld.,1.0m,97,"Jun 8, 2013"
DanLeBatardShow,https://www.reddit.com/r/DanLeBatardShow/,Welcome to DanLeBatardShow,38.5k,330,"Oct 16, 2014"
mylittlepony,https://www.reddit.com/r/mylittlepony/,"/r/mylittlepony is the premier subreddit for all things related to My Little Pony, with emphasis on Generation 4 and forward. Here all fans can discuss the show, share creative works, or connect with fellow members of the community in a safe for work and friendly environment!",116k,273,"Dec 16, 2010"
Jeopardy,https://www.reddit.com/r/Jeopardy/,"/r/Jeopardy, a subreddit for the appreciation of The World's Greatest Game Show: JEOPARDY!  

This subreddit is not affiliated with, sponsored by, or operated by Jeopardy Productions or Sony Pictures.",74.6k,390,"Sep 18, 2010"
SpoiledDragRace,https://www.reddit.com/r/SpoiledDragRace/,"/r/SpoiledDragRace is a subreddit devoted to collecting insider speculation, alleged information, and spoilers about the RuPaul's Drag Race franchise.

---

RuPaul’s Drag Race Spoilers. All information here is rumor and speculation. r/SpoiledDragRace is not affiliated with or endorsed by World of Wonder, Viacom or any of its subsidiaries. It is intended for entertainment and community purposes only.",73.5k,564,"Feb 15, 2018"
Gundam,https://www.reddit.com/r/Gundam/,Welcome to r/Gundam! Before you post please check to see if your content or questions have been submitted before! New to Gundam? Please check out our [FAQ](http://www.reddit.com/r/Gundam/wiki/index) first which has a bunch of useful information!!,123k,387,"Jun 8, 2011"
MakingaMurderer,https://www.reddit.com/r/MakingaMurderer/,The main subreddit for discussion surrounding the Netflix docuseries Making a Murderer and the Steven Avery and Brendan Dassey cases.,76.8k,154,"Nov 29, 2015"
vanderpumprules,https://www.reddit.com/r/vanderpumprules/,"Welcome to r/vanderpumprules, a sub for discussing the show Vanderpump rules and its current and former cast members. 

Please review the rules before posting and remember... it's NOT about the pasta!",79.7k,660,"Jan 31, 2014"
StarVStheForcesofEvil,https://www.reddit.com/r/StarVStheForcesofEvil/,"Welcome to the Star VS the Forces of Evil subreddit. The show ended in May 2019, but that doesn't mean the fun is over! You might be a brand-new fan looking for a show that's a little weird and wild, or maybe you're an old fan still lurking around because you aren't ready to say goodbye to our beloved show. Either way, you're welcome here!",274k,136,"Aug 1, 2014"
shield,https://www.reddit.com/r/shield/,Marvel's Agents of S.H.I.E.L.D.,140k,92,"Jul 29, 2010"
anime_irl,https://www.reddit.com/r/anime_irl/,"relatable screenshots from anime and manga.

post who you are behind the keyboard. all posts must be titled anime_irl.",1.6m,1.4k,"May 11, 2015"
