Topic Names,Topic Urls,Topic Description,Followers,Active,Created Date
TheDickShow,https://www.reddit.com/r/TheDickShow/,"Dedicated to the podcast by Dick Masterson, The Dick Show.",18.4k,57,"Jun 6, 2016"
rpdrcringe,https://www.reddit.com/r/rpdrcringe/,"""Pearl, what would you say to little Matt?"" - RuPaul (1960-2015)",42.1k,245,"Oct 26, 2015"
TheAmazingRace,https://www.reddit.com/r/TheAmazingRace/,Reddit's home for The Amazing Race!,27.0k,228,"Sep 2, 2011"
LegendsOfTomorrow,https://www.reddit.com/r/LegendsOfTomorrow/,When heroes alone are not enough… the world needs legends.,61.8k,88,"Apr 21, 2015"
marvelmemes,https://www.reddit.com/r/marvelmemes/,Welcome to r/marvelmemes: The home of Marvel memes on Reddit!,1.8m,3.2k,"Dec 31, 2014"
SequelMemes,https://www.reddit.com/r/SequelMemes/,Memes of the Star Wars Sequels,456k,311,"Jan 14, 2017"
ImaginaryWesteros,https://www.reddit.com/r/ImaginaryWesteros/,Paintings and drawings inspired by the book series A Song of Ice and Fire and the television show Game of Thrones.,170k,89,"Dec 29, 2013"
HBOGameofThrones,https://www.reddit.com/r/HBOGameofThrones/,"A subreddit for the HBO TV show Game of Thrones.

For book content go to /r/ASoIaF and /r/GameofThrones",94.4k,15,"Apr 28, 2012"
GameOfThronesMemes,https://www.reddit.com/r/GameOfThronesMemes/,Share Game Of Thrones related memes and quotes with other people :),157k,20,"Mar 30, 2014"
aSongOfMemesAndRage,https://www.reddit.com/r/aSongOfMemesAndRage/,"A place to post meme and rage-comic links related to George R.R. Martin's *A Song of Ice and Fire* book series and the HBO show based on his works, *Game of Thrones*.

Serious discussions will not be tolerated. Please visit /r/asoiaf or /r/gameofthrones for those.",118k,52,"Mar 24, 2012"
vancouver,https://www.reddit.com/r/vancouver/,"The most boring, irrelevant city in the world™",385k,3.5k,"Mar 28, 2008"
brasil,https://www.reddit.com/r/brasil/,"A casa dos brasileiros no Reddit. Leia as regras e participe de nossa comunidade!

The Brazilian community on Reddit. Feel free to post in English or Portuguese!",799k,1.8k,"Feb 15, 2008"
australia,https://www.reddit.com/r/australia/,A dusty corner on the internet where you can chew the fat about Australia and Australians.,796k,3.3k,"Jan 26, 2008"
mexico,https://www.reddit.com/r/mexico/,MÉXICO,615k,1.2k,"Apr 26, 2008"
argentina,https://www.reddit.com/r/argentina/,"Noticias, imágenes e información y todo lo demás que tenga que ver con Argentina en reddit!  - 
News, images, links and everything related to Argentina in reddit!
English speakers Welcome!",356k,1.6k,"Aug 26, 2008"
melbourne,https://www.reddit.com/r/melbourne/,A subreddit for Melburnians and Melbourne enthusiasts!,440k,680,"Jul 25, 2008"
ottawa,https://www.reddit.com/r/ottawa/,"News, events, discussions, and what not from Ottawa, Ontario.",174k,1.5k,"Dec 10, 2008"
korea,https://www.reddit.com/r/korea/,"A subreddit for news, culture, and life on the Korean Peninsula. Welcome to everyone, including native Koreans, Korean diaspora, and foreigners.",248k,462,"Jun 10, 2008"
ireland,https://www.reddit.com/r/ireland/,"Céad míle fáilte! An all-island subreddit for discussion of Irish news, politics, culture, history and society.",475k,4.1k,"Mar 3, 2008"
travel,https://www.reddit.com/r/travel/,"r/travel is a community about exploring the world. Your pictures, questions, stories, or any good content is welcome. 

Clickbait, spam, memes, ads, brochures, classifieds, surveys or self-promotion will be removed.",6.1m,1.2k,"Jan 25, 2008"
Calgary,https://www.reddit.com/r/Calgary/,"The City of Calgary, Alberta, Canada.",225k,1.3k,"Oct 2, 2008"
portugal,https://www.reddit.com/r/portugal/,"Um lugar para discutir Portugal ou portugueses pelo mundo.

— A place to discuss Portugal and portuguese people around the world.",211k,1.7k,"Sep 15, 2008"
india,https://www.reddit.com/r/india/,The Official Subreddit for India,689k,3.1k,"Jan 25, 2008"
sweden,https://www.reddit.com/r/sweden/,"Hej and wälkommen to Sweddit!

The hub for Swedes on reddit and our community here! Visiting redditors from elsewhere are also welcome! This subreddit is moderated after the reddiquette and these community guidelines:

https://www.reddit.com/r/sweden/wiki/community_guidelines",371k,2.3k,"Nov 11, 2008"
italy,https://www.reddit.com/r/italy/,"Reddit Italy - Italia

Welcome everyone! This is a place to post and discuss anything related to Italy. We also speak English!",363k,1.0k,"Jul 25, 2008"
AskNYC,https://www.reddit.com/r/AskNYC/,Please read the sidebar on old.reddit.com/r/asknyc before posting since new reddit does not allow space for rules/links/guidance.,132k,835,"Aug 10, 2012"
europe,https://www.reddit.com/r/europe/,"Europe: 50 (+6) countries, 230 languages, 746M people… 1 subreddit.",2.9m,4.6k,"Jan 25, 2008"
sydney,https://www.reddit.com/r/sydney/,"Links relating to the City of Sydney, and NSW in general - please read our rules before posting.",306k,468,"Jul 30, 2008"
france,https://www.reddit.com/r/france/,La France et les Français.,750k,3.7k,"Mar 19, 2008"
de,https://www.reddit.com/r/de/,"Das Sammelbecken für alle Deutschsprechenden, hauptsächlich auf Deutsch, manchmal auch auf Englisch. Für Deutschland, Österreich, Schweiz, Liechtenstein, Luxemburg und den einen Belgier.",564k,4.6k,"Feb 20, 2006"
dubai,https://www.reddit.com/r/dubai/,"A sub to discuss things that affect you and the Dubai community.  Keep conversation respectful. Debate is welcome, but Dubai bashing is not.",153k,656,"Dec 11, 2008"
LearnJapanese,https://www.reddit.com/r/LearnJapanese/,"Welcome to r/LearnJapanese, *the* hub on Reddit for learners of the Japanese Language.",509k,556,"May 15, 2009"
China,https://www.reddit.com/r/China/,"A community for discussing China and topics related to it. All viewpoints and opinions are welcome here, but please read the rules in the sidebar before posting.",353k,448,"Jan 25, 2008"
Edmonton,https://www.reddit.com/r/Edmonton/,Edmonton's Local Subreddit! For Edmontonians by Edmontonians!,153k,1.1k,"Oct 21, 2009"
germany,https://www.reddit.com/r/germany/,English-language discussions and news relating to Germany and German culture.,379k,819,"May 27, 2008"
houston,https://www.reddit.com/r/houston/,Welcome to houston,298k,837,"Jun 19, 2008"
CasualUK,https://www.reddit.com/r/CasualUK/,"UK based subreddit for non-political news, commentary and discussion.",944k,5.3k,"Feb 13, 2017"
malaysia,https://www.reddit.com/r/malaysia/,A subreddit for Malaysia and all things Malaysian.,240k,360,"Jan 26, 2008"
askTO,https://www.reddit.com/r/askTO/,A subreddit for people to submit questions to Torontonians and about Toronto and receive constructive responses.,92.4k,1.4k,"Jun 13, 2013"
JapanTravel,https://www.reddit.com/r/JapanTravel/,Got questions? Need advice? Overwhelmed with your itinerary? Want to share your travel tips and experiences in Japan? Then this is the place for you! /r/JapanTravel is for any and all looking to visit Japan as a tourist — including those who have already been.,1.8m,85,"Sep 5, 2012"
solotravel,https://www.reddit.com/r/solotravel/,A place for all of those interested in solo travel to share their experiences and stories!,2.0m,427,"Jul 18, 2010"
newzealand,https://www.reddit.com/r/newzealand/,Kia Ora and welcome to the largest subreddit for Aotearoa New Zealand!,333k,1.1k,"Mar 23, 2008"
bayarea,https://www.reddit.com/r/bayarea/,"All the best things to do, to see, and discuss in the San Francisco Bay Area!",421k,1.4k,"Jul 11, 2008"
Turkey,https://www.reddit.com/r/Turkey/,"This subreddit is for news and discussion about Turkey. Posts both in English and Turkish are welcome.


| Bu subreddit Türkiye ile ilgili haber ve sohbet ortamıdır. Türkçe veya İngilizce yazabilirsiniz.",381k,923,"Aug 27, 2008"
Portland,https://www.reddit.com/r/Portland/,"/r/Portland is the regional subreddit for Portland, Oregon and its residents.",258k,1.2k,"May 26, 2008"
thenetherlands,https://www.reddit.com/r/thenetherlands/,"Welcome to the largest bilingual Reddit community for sharing anything related to the Netherlands: news, sports, humor, culture and questions. Please browse our FAQ before posting!",607k,1.3k,"Feb 20, 2014"
Atlanta,https://www.reddit.com/r/Atlanta/,"Subreddit for all things in and about Atlanta, Georgia, USA and the surrounding metropolitan area.",384k,375,"Jun 11, 2008"
brisbane,https://www.reddit.com/r/brisbane/,"All things Brisbane, Australia!",171k,219,"Mar 13, 2009"
Seattle,https://www.reddit.com/r/Seattle/,"News, current events in & around Seattle, Washington, USA.",411k,1.4k,"Feb 29, 2008"
halifax,https://www.reddit.com/r/halifax/,"Welcome to the subreddit of Halifax Regional Municipality, Nova Scotia, Canada.",72.3k,1.3k,"Sep 15, 2009"
chile,https://www.reddit.com/r/chile/,La comunidad chilena de Reddit / The Chilean Reddit community (we speak English too!),228k,931,"Dec 23, 2009"
Winnipeg,https://www.reddit.com/r/Winnipeg/,Honey Dill for the Soul,80.9k,1.9k,"Feb 22, 2009"
japanlife,https://www.reddit.com/r/japanlife/,"For people already living in Japan - anything relevant to living or working in Japan such as lifestyle, food, style, environment, education, technology, housing, work, immigration, sport etc.",339k,346,"Jan 16, 2010"
philadelphia,https://www.reddit.com/r/philadelphia/,"News and happenings in and around Philadelphia, Pennsylvania.",371k,1.1k,"Jan 25, 2008"
hungary,https://www.reddit.com/r/hungary/,Üdvözlünk a /r/hungary-n!,178k,1.3k,"Jun 8, 2009"
sandiego,https://www.reddit.com/r/sandiego/,"The official subreddit for San Diego California,  ""America's Finest City"",  we’re a rapidly growing (over 245,000 strong!) community serving the whole of the San Diego.  We also serve the various counties, plus info concerning our sister city Tijuana MX in the sharing of information, opinion and events to bring us closer together in the richness & diversity that makes us “America’s finest city” 

* Local Covid-19 information regularly updated by our users.",249k,697,"Dec 18, 2008"
Denver,https://www.reddit.com/r/Denver/,The Mile High Reddit!,260k,1.1k,"Oct 2, 2008"
Romania,https://www.reddit.com/r/Romania/,"Romania, a country famous for its beautiful landscapes, rich history and awesome people. This is our little Romanian corner of Reddit!",340k,1.7k,"Sep 4, 2008"
flightsim,https://www.reddit.com/r/flightsim/,"For all those who love to fly the virtual skies.
Please note, accounts less than 4 days old cannot post or comment.",153k,460,"Feb 6, 2009"
translator,https://www.reddit.com/r/translator/,"r/translator is *the* community for Reddit translation requests.  
  
Need something translated? Post here!  
  
We will help you translate any language, including Japanese, Chinese, German, Arabic, and many others. If you speak more than one language - especially rare ones - and want to put your multilingual skills to use, come join us!",118k,270,"Aug 26, 2011"
Dallas,https://www.reddit.com/r/Dallas/,"/r/Dallas is a home for discussion and content related to the Dallas/Fort Worth Metroplex. We strive to be a friendly and welcoming community to all of our users whether they are longtime residents of DFW, newcomers, curious redditors, or just visiting.",276k,553,"Oct 17, 2008"
Columbus,https://www.reddit.com/r/Columbus/,"Events, get togethers, and suggestions on what to see and do in Columbus, Ohio!",129k,493,"Jul 25, 2009"
pittsburgh,https://www.reddit.com/r/pittsburgh/,"Community curated front page of Pittsburgh's place on the internet.

Share news, events, and thoughts with/about the Pittsburgh community.",149k,588,"Apr 7, 2008"
berkeley,https://www.reddit.com/r/berkeley/,"A subreddit for the community of UC Berkeley as well as the surrounding City of Berkeley, California. Welcome!",101k,522,"Feb 27, 2008"
nashville,https://www.reddit.com/r/nashville/,News about Nashville TN USA,161k,845,"Jun 8, 2008"
phoenix,https://www.reddit.com/r/phoenix/,"Everything hot in and around Phoenix, Arizona",215k,391,"Sep 21, 2008"
VictoriaBC,https://www.reddit.com/r/VictoriaBC/,"Welcome to r/VictoriaBC! This subreddit is for residents of Victoria, BC, Canada and the Capital Regional District. Please take a moment to read the sidebar for our guidelines, related subreddits and helpful resources regarding housing, tourism and employment.",63.4k,668,"Nov 5, 2009"
greece,https://www.reddit.com/r/greece/,The Greek side of reddit,139k,822,"Jan 26, 2008"
WaltDisneyWorld,https://www.reddit.com/r/WaltDisneyWorld/,"This subreddit is dedicated to all things Walt Disney World! Come and share your experiences with more than 450,000 other mouse lovers!",464k,623,"Jan 19, 2012"
Austria,https://www.reddit.com/r/Austria/,"Subreddit für Österreicher und Austrophile, alles mit Österreichbezug ist hier gern gesehen.



Subbreddit for Austrians and Austrophiles, everything relevant to Austria is encouraged here.",287k,27.9k,"Nov 8, 2008"
norge,https://www.reddit.com/r/norge/,Et reddit på norsk for norske redditører og norske saker.,180k,1.4k,"Feb 6, 2008"
Sacramento,https://www.reddit.com/r/Sacramento/,"A forum about Sacramento, for Sacramento.",121k,500,"May 19, 2008"
kansascity,https://www.reddit.com/r/kansascity/,"A subreddit dedicated to the Kansas City metro area. This includes Kansas City, Missouri, as well as suburbs in both Kansas and Missouri.",112k,392,"Oct 13, 2008"
croatia,https://www.reddit.com/r/croatia/,"We are /r/croatia, the largest subreddit for discussion about everything related to Croatia. Everyone is welcome!",154k,1.5k,"May 18, 2009"
sanfrancisco,https://www.reddit.com/r/sanfrancisco/,"Cold summers, thick fog, and beautiful views. Welcome to the subreddit for the gorgeous City by the Bay! San Francisco, California, USA.",319k,508,"Jan 25, 2008"
vzla,https://www.reddit.com/r/vzla/,Llevo tu luz y tu aroma en mi piel,89.0k,93,"May 8, 2011"
Suomi,https://www.reddit.com/r/Suomi/,"Suomenkielinen keskustelualue Redditissä.

*The Finnish subreddit for natives and proficient users of the language.*",207k,1.5k,"Aug 27, 2008"
Denmark,https://www.reddit.com/r/Denmark/,"A forum for discussions, funny tidbits and news about Denmark and the Danes.",274k,1.5k,"Jul 8, 2008"
orangecounty,https://www.reddit.com/r/orangecounty/,"/r/OrangeCounty - subreddit for Orange County, California",243k,513,"Nov 24, 2009"
StLouis,https://www.reddit.com/r/StLouis/,"/r/StLouis is dedicated to the news, events, and weird food of the Greater St. Louis and surrounding areas. Please check out our sidebar and wiki for a plethora of knowledge.",116k,420,"Dec 9, 2008"
nova,https://www.reddit.com/r/nova/,"A community for Northern Virginia -- Alexandria, Arlington County, Fairfax County, Falls Church, Loudoun County, Prince William County, and the surrounding areas.",177k,978,"Feb 20, 2010"
Disneyland,https://www.reddit.com/r/Disneyland/,Welcome to Disneyland,375k,374,"Aug 8, 2010"
Quebec,https://www.reddit.com/r/Quebec/,Tout à propos de la belle province,165k,2.6k,"Mar 14, 2008"
Minneapolis,https://www.reddit.com/r/Minneapolis/,"Minneapolis, Minnesota (MN)",149k,581,"Jul 27, 2009"
saskatoon,https://www.reddit.com/r/saskatoon/,For the people of Saskatoon,37.2k,364,"Nov 4, 2009"
awardtravel,https://www.reddit.com/r/awardtravel/,A place to discuss burning airline miles & hotel points.,293k,243,"Jan 7, 2015"
raleigh,https://www.reddit.com/r/raleigh/,"Raleigh is the capital of the state of North Carolina as well as the seat of Wake County. Raleigh is known as the ""City of Oaks"" for its many oak trees.",115k,691,"Jun 24, 2009"
SaltLakeCity,https://www.reddit.com/r/SaltLakeCity/,"A subreddit for Salt Lake City, UT and the surrounding valley.",127k,655,"Sep 16, 2009"
NewOrleans,https://www.reddit.com/r/NewOrleans/,"This is the subreddit for the Greater New Orleans area. This sub is for locals to discuss all things New Orleans. All tourist questions of any type should be asked at r/askNOLA.


This subreddit is NOT for hookups, finding drugs, tourists, or tourist questions. If you post here about these things, you will be shunned and talked to quite harshly. 


Laissez Les Bon Temps Rouler!


What is damp may never dry!",100k,550,"Mar 30, 2008"
Polska,https://www.reddit.com/r/Polska/,Subreddit dla piszących i czytających po polsku. English posts are welcome if tagged as English 🇬🇧.,375k,1.3k,"Jun 12, 2008"
Charlotte,https://www.reddit.com/r/Charlotte/,"A subreddit for Charlotte, North Carolina. Where residents and visitors alike can share news, events, gatherings, stories, and more.  Tirades, Welcome to Charlotte, Things to do, Buying/Selling, and Charity are all weekly topics.",140k,317,"Nov 2, 2008"
Wellington,https://www.reddit.com/r/Wellington/,"Welcome to Wellington, New Zealand!  

Whether you're living here, moving here or are just curious, feel free to browse around and ask questions.",55.3k,225,"Sep 2, 2010"
rva,https://www.reddit.com/r/rva/,"News, events, and goings-on in and around Richmond, Virginia. And the cat at the Lowes.",106k,527,"Dec 13, 2008"
Adelaide,https://www.reddit.com/r/Adelaide/,Farmers Union and Malls Balls go here.,78.3k,254,"Jun 30, 2009"
brasilivre,https://www.reddit.com/r/brasilivre/,"Subreddit brasileiro livre de todo tipo de censura. Fale, converse, discuta sobre o que quiser.

An uncensored brazilian subreddit, speak your mind.

Não exige e-mail verificado.",176k,508,"Nov 22, 2014"
Scotland,https://www.reddit.com/r/Scotland/,"Scotland - all things Scotland, Scottish and Scot here.",195k,910,"Jul 28, 2008"
indonesia,https://www.reddit.com/r/indonesia/,"Selamat datang di subreddit kami! Welcome to our subreddit!

Please follow the rules and respect others.

Feel free to ask the moderators about anything!",121k,284,"Aug 4, 2008"
IWantOut,https://www.reddit.com/r/IWantOut/,Welcome to r/IWantOut: Reddit's expatriate community. Please take a look at the sidebar for some tips for getting the most out of it.,1.4m,210,"Aug 24, 2009"
serbia,https://www.reddit.com/r/serbia/,"Dobro došli na r/Serbia, najveći srpski kutak na redditu. Upoznajte zemlju fascinantne prirode, dobrog provoda i još boljih ljudi.

/////

Welcome to r/serbia, the largest Serbian community on reddit. Explore a country of incredible nature, great parties and even better people.",121k,1.3k,"Aug 9, 2008"
rollercoasters,https://www.reddit.com/r/rollercoasters/,"A subreddit for discussions, photos, news, and updates for the world of roller coasters and amusement parks!",74.0k,273,"Jul 30, 2010"
Detroit,https://www.reddit.com/r/Detroit/,Discover and discuss news and events happening in Detroit and the surrounding region.,135k,309,"Jul 27, 2008"
sanantonio,https://www.reddit.com/r/sanantonio/,"For everything you want to see, do, eat, and buy in the Alamo City, and places you can drive to within an hour of SA! Visit us for The Alamo, The Missions world heritage site, Six Flags and Sea World. Interesting posts about nearby places like Boerne, Poteet and New Braunfels are welcome, too. Stay for the tacos, the friendly locals, and Fiesta!",128k,286,"Dec 23, 2008"
Israel,https://www.reddit.com/r/Israel/,"A place for discussion of Israeli life and culture, but most of all for participating in the time honored tradition of arguing politics.",159k,205,"Apr 28, 2008"
Shoestring,https://www.reddit.com/r/Shoestring/,"A community to discuss frugal travelling, last-minute travel deals, cheap destinations, and cheap means of travel. Whether couchsurfing, camping, or staying in hostels, whether hitchhiking or staying on Airbnb, let's discuss and share the best budget travel ideas and deals!",1.4m,77,"Dec 23, 2012"
podemos,https://www.reddit.com/r/podemos/,"En un momento de enorme dificultad y empobrecimiento para la inmensa mayoría de las personas, Podemos nace para convertir la indignación en cambio político, y para construir democracia a través de la participación ciudadana y la unidad popular.",26.3k,54,"Apr 23, 2014"
newsokur,https://www.reddit.com/r/newsokur/,"ニュー速R（ニュース速報@Reddit）は様々なニュースや話題を扱う掲示板（サブレディット）です。

Newsokur (Breaking News on Reddit) is a subreddit for Japanese news and various other topics.",36.2k,101,"Feb 17, 2015"
vagabond,https://www.reddit.com/r/vagabond/,"An Uncensored Nomadic Community Created by Vagabonds, for Vagabonds!

Hitchhikers / Trainhoppers /  Squatters / Rubbertramps / Vandwellers / Backpackers / Biketramps /  Boatpunks / Dirty Kids / Crustpunks, and ALL.


Feel free to share stories and pictures about your adventures on the road, or share advice and tips with newbie greenhorns, and curious lurkers!",1.1m,114,"Apr 16, 2010"
TurkeyJerky,https://www.reddit.com/r/TurkeyJerky/,"Burası TC'ye karşı gelinecek yer değildir.

discord sunucusu: https://discord.gg/kkCsBz5",179k,249,"Sep 30, 2017"
roadtrip,https://www.reddit.com/r/roadtrip/,"/r/roadtrip is your source for everything road trip related. Whether you enjoy traveling by motorcycle, car, or recreational vehicle this is your destination for everything related to road trips!",1.7m,97,"Aug 5, 2009"
cirkeltrek,https://www.reddit.com/r/cirkeltrek/,De Koninklijke Nederlandsche Cirkeltrek,87.2k,134,"Apr 6, 2014"
orangetheory,https://www.reddit.com/r/orangetheory/,"The unofficial community for anyone interested in Orangetheory Fitness. Come here to discuss the workouts, the results, and get help from your fellow OTFers. We are operated and moderated by community members, and we are not affiliated with the Orangetheory Fitness company.",162k,917,"Sep 10, 2015"
bodybuilding,https://www.reddit.com/r/bodybuilding/,"News, articles, personal pictures, videos & advice on everything related to bodybuilding - nutrition, supplementation, training, contest preparation, and more.",1.9m,1.1k,"Aug 18, 2008"
bodyweightfitness,https://www.reddit.com/r/bodyweightfitness/,"Bodyweight Fitness is for redditors who like to use their own body to train, from the simple pullups, pushups, and squats to the advanced bodyweight fitness movements like the planche, one arm chin-ups, or single leg squats.

Start your fitness journey with one of the recommended routines in our wiki!",2.3m,847,"Jan 22, 2012"
vegan,https://www.reddit.com/r/vegan/,"Veganism: ""A philosophy and way of living which seeks to exclude—as far as is possible and practicable—all forms of exploitation of, and cruelty to, animals for food, clothing or any other purpose; and by extension, promotes the development and use of animal-free alternatives for the benefit of humans, animals and the environment. In dietary terms it denotes the practice of dispensing with all products derived wholly or partly from animals."" - The Vegan Society",751k,1.1k,"Mar 31, 2008"
crossfit,https://www.reddit.com/r/crossfit/,"This SubReddit is for discussion of CrossFit, functional fitness, weightlifting and the lifestyle, nutrition and training methodologies involved.",312k,469,"Dec 25, 2008"
nattyorjuice,https://www.reddit.com/r/nattyorjuice/,"A place away from /r/bodybuilding & /r/steroids to discuss whether the people you post are on some sort of juicy substance or not. 

We also answer the tough fitness questions that other subs don't, can't or won't.

Why not make a throwaway, upload a pic of yourself and see if people think you are **natty or on juice.**

***NOTE***: if the person you are submitting makes a living off their physique you can near guarantee that juice is involved.",120k,831,"Jun 21, 2013"
EatCheapAndHealthy,https://www.reddit.com/r/EatCheapAndHealthy/,Eating healthy on a cheap budget,3.7m,1.2k,"Dec 27, 2012"
loseit,https://www.reddit.com/r/loseit/,"A place for people of all sizes to discuss healthy and sustainable methods of weight loss. Whether you need to lose 2 lbs or 400 lbs, you are welcome here!",3.1m,1.8k,"Jul 29, 2010"
xxfitness,https://www.reddit.com/r/xxfitness/,"We're a community targeted at female and gender non binary/gender non conforming redditors to discuss fitness.  However, all genders are welcome to contribute, all we ask is that you abide by the rules.",586k,500,"Jul 27, 2010"
nutrition,https://www.reddit.com/r/nutrition/,"A subreddit for the discussion of nutrition science.  Macronutrients, micronutrients, vitamins, diets, and nutrition news are among the many topics discussed.

Civil discourse is required.",2.2m,644,"Nov 17, 2008"
powerlifting,https://www.reddit.com/r/powerlifting/,A subreddit for the sport of powerlifting,338k,216,"Oct 3, 2010"
1200isplenty,https://www.reddit.com/r/1200isplenty/,"A sub for recipes, memes, and support related to low-calorie diets, targeted at people who have low TDEEs.",425k,708,"Jun 14, 2013"
GetMotivated,https://www.reddit.com/r/GetMotivated/,"Welcome to /r/GetMotivated! We’re glad you made it. This is the subreddit that will help you finally get up and do what you *know* you need to do. It’s the subreddit to give and receive motivation through pictures, videos, text, music, AMA’s, personal stories, and anything and everything that you find particularly motivating and/or inspiring.

So browse around, ask questions, give advice, form/join a support group. But don’t spend too much time here; you’ve got *better* things to do.",17.5m,2.4k,"Mar 27, 2010"
intermittentfasting,https://www.reddit.com/r/intermittentfasting/,"Intermittent Fasting(IF) is way of eating that restricts *when* you eat, usually on a daily or weekly schedule.  People engage in IF to reap the many benefits to health, fitness, and mental clarity.  This is a place to share success, support each other, ask questions, and learn.

IF is an 18+ community because the practice is not medically recommended to/for children.",808k,690,"Feb 22, 2012"
