Topic Names,Topic Urls,Topic Description,Followers,Active,Created Date
AskReddit,https://www.reddit.com/r/AskReddit/,r/AskReddit is the place to ask and answer thought-provoking questions.,34.5m,70.6k,"Jan 25, 2008"
NoStupidQuestions,https://www.reddit.com/r/NoStupidQuestions/,Ask away!,2.5m,14.2k,"Feb 2, 2013"
DestinyTheGame,https://www.reddit.com/r/DestinyTheGame/,,,,
explainlikeimfive,https://www.reddit.com/r/explainlikeimfive/,,,,
AskMen,https://www.reddit.com/r/AskMen/,It's time to stop.,3.2m,9.9k,"Aug 30, 2010"
leagueoflegends,https://www.reddit.com/r/leagueoflegends/,,,,
Minecraft,https://www.reddit.com/r/Minecraft/,,,,
anime,https://www.reddit.com/r/anime/,,,,
IAmA,https://www.reddit.com/r/IAmA/,,,,
AskWomen,https://www.reddit.com/r/AskWomen/,"AskWomen: A subreddit dedicated to asking women questions about their thoughts, lives, and experiences; providing a place where all women can comfortably and candidly share their responses in a non-judgmental space. As part of our commitment to that mission, the AskWomen subreddit is curated to promote respectful and on-topic discussions, and not serve as a debate subreddit.",3.0m,4.7k,"Jul 17, 2010"
OutOfTheLoop,https://www.reddit.com/r/OutOfTheLoop/,A subreddit to help you keep up to date with what's going on with reddit and other stuff.,2.7m,2.7k,"Jun 10, 2013"
Fitness,https://www.reddit.com/r/Fitness/,"A place for the pursuit of physical fitness goals.

Please see [the r/Fitness Wiki and FAQ](https://thefitness.wiki) for help with common questions.",8.8m,2.1k,"May 7, 2008"
destiny2,https://www.reddit.com/r/destiny2/,"All about Destiny 2: The epic, online-only looter-shooter MMO from Bungie, which launched in September of 2017.",713k,2.3k,"Feb 18, 2013"
classicwow,https://www.reddit.com/r/classicwow/,A community for World of Warcraft: Classic fans.,471k,1.8k,"Apr 23, 2016"
PS4,https://www.reddit.com/r/PS4/,"The largest PlayStation 4 community on the internet.  Your hub for everything related to PS4 including games, news, reviews, discussion, questions, videos, and screenshots.",5.0m,3.1k,"May 17, 2010"
discordapp,https://www.reddit.com/r/discordapp/,"Imagine a Place... where you can belong to a school club, a gaming group, or a worldwide art community. Where just you and handful of friends can spend time together. A place that makes it easy to talk every day and hang out more often.

NOTE: /r/discordapp is unofficial & community-run.",949k,2.4k,"May 15, 2015"
DnD,https://www.reddit.com/r/DnD/,"A subreddit dedicated to the various iterations of Dungeons & Dragons, from its First Edition roots to its Fifth Edition future.",2.5m,4.6k,"Oct 10, 2009"
FIFA,https://www.reddit.com/r/FIFA/,The front page of EA Sports FIFA.,571k,5.6k,"Apr 28, 2009"
Instagram,https://www.reddit.com/r/Instagram/,"The un-official (and unaffiliated) subreddit for Instagram.com - Learn tips and tricks, ask questions and get feedback on your account. Come join our great community of over 190,000 users!",210k,753,"Mar 30, 2011"
apple,https://www.reddit.com/r/apple/,"An unofficial community to discuss Apple devices and software, including news, rumors, opinions and analysis pertaining to the company located at One Apple Park Way.",3.0m,7.3k,"Jan 25, 2008"
Twitch,https://www.reddit.com/r/Twitch/,"/r/Twitch is an unofficial place for discussions surrounding the streaming website Twitch.tv. If you want to provide feedback, ask a question or show some quality content, this is the place for you!",1.2m,1.9k,"Aug 9, 2010"
videos,https://www.reddit.com/r/videos/,"Reddit's main subreddit for videos.

Please read the sidebar below for our rules.",26.0m,13.4k,"Jan 25, 2008"
FortNiteBR,https://www.reddit.com/r/FortNiteBR/,"The developer supported, community run subreddit dedicated to the Fortnite: Battle Royale game mode by Epic Games.",1.7m,2.6k,"Sep 13, 2017"
NintendoSwitch,https://www.reddit.com/r/NintendoSwitch/,"The central hub for all news, updates, rumors, and topics relating to the Nintendo Switch. We are a fan-run community, not an official Nintendo forum.",3.6m,3.6k,"Oct 20, 2016"
NBA2k,https://www.reddit.com/r/NBA2k/,,,,
gtaonline,https://www.reddit.com/r/gtaonline/,"Grand Theft Auto Online - Rockstar's ongoing ever expanding multiplayer system, introduced by Grand Theft Auto V.",1.2m,4.8k,"Jul 3, 2013"
wow,https://www.reddit.com/r/wow/,World of Warcraft on Reddit!,2.2m,4.4k,"Jun 10, 2008"
dndnext,https://www.reddit.com/r/dndnext/,"A place to discuss the latest version of Dungeons and Dragons, the fifth edition, known during the playtest as D&D Next.",572k,3.0k,"Oct 17, 2012"
Tinder,https://www.reddit.com/r/Tinder/,"A community for discussing the online dating app Tinder. Sharing conversations, reviewing profiles and more.",5.1m,19.3k,"Feb 1, 2013"
xboxone,https://www.reddit.com/r/xboxone/,Your one source for all things Xbox on Reddit!,3.4m,2.4k,"May 21, 2013"
relationship_advice,https://www.reddit.com/r/relationship_advice/,"Need help with your relationship? Whether it's romance, friendship, family, co-workers, or basic human interaction: we're here to help!",6.1m,15.9k,"Jun 14, 2009"
Amd,https://www.reddit.com/r/Amd/,"Welcome to /r/AMD — the subreddit for all things AMD; come talk about Ryzen, Threadripper, EPYC, RDNA3, rumors, show-off your build and more.

/r/AMD is community run and does not represent AMD in any capacity unless specified.",1.2m,2.8k,"Jul 1, 2010"
buildapc,https://www.reddit.com/r/buildapc/,"Planning on building a computer but need some advice? This is the place to ask!

/r/buildapc is a community-driven subreddit dedicated to custom PC assembly. Anyone is welcome to seek the input of our helpful community as they piece together their desktop.",4.8m,7.6k,"Apr 11, 2010"
todayilearned,https://www.reddit.com/r/todayilearned/,"You learn something new every day; what did you learn today?
Submit interesting and specific facts about something that you just found out here.",26.7m,8.5k,"Dec 28, 2008"
sysadmin,https://www.reddit.com/r/sysadmin/,A reddit dedicated to the profession of Computer System Administration.,663k,3.1k,"Oct 22, 2008"
OnePiece,https://www.reddit.com/r/OnePiece/,"Welcome to r/OnePiece, the community for Eiichiro Oda's manga and anime series One Piece. From the East Blue to the New World, anything related to the world of One Piece belongs here! If you've just set sail with the Straw Hat Pirates, be wary of spoilers on this subreddit!",902k,7.2k,"Jan 14, 2010"
malefashionadvice,https://www.reddit.com/r/malefashionadvice/,"Reddit's largest men's fashion community. Making clothing less intimidating and helping you develop your own style. We welcome those who want to learn and those who want to contribute. 

We aim to foster an environment where everybody feels safe and welcomed and where people feel encouraged to have healthy and productive discussions.",3.6m,1.4k,"Sep 3, 2009"
techsupport,https://www.reddit.com/r/techsupport/,"Stumped on a Tech problem?  Ask the tech support reddit, and try to help others with their problems as well.


Be sure to check out the Discord server, too!
https://discord.gg/2EDwzWa",1.6m,2.1k,"Jun 10, 2008"
iphone,https://www.reddit.com/r/iphone/,Reddit’s corner for iPhone lovers (or those who mildly enjoy it...),3.4m,1.3k,"Jan 25, 2008"
nba,https://www.reddit.com/r/nba/,A subreddit dedicated to NBA news and discussion.,4.4m,22.4k,"Nov 4, 2008"
GlobalOffensive,https://www.reddit.com/r/GlobalOffensive/,"r/GlobalOffensive is a home for the Counter-Strike: Global Offensive community and a hub for the discussion and sharing of content relevant to CS:GO. 

Counter-Strike: Global Offensive is a game created by Valve Corporation and released on August 21st, 2012 as a successor to previous games in the series dating back to 1999. The latest installment to the Counter-Strike franchise maintains a healthy, ever-intensifying competitive scene alongside a growing casual playerbase.",1.5m,3.7k,"Aug 12, 2011"
reddeadredemption,https://www.reddit.com/r/reddeadredemption/,"/r/RedDeadRedemption - A subreddit dedicated to Red Dead Redemption & Red Dead Redemption 2, developed by Rockstar Games, the creators behind the Grand Theft Auto series.

Red Dead Redemption 2 is an epic tale of life in America’s unforgiving heartland. The game’s vast and atmospheric world will also provide the foundation for a brand new online multiplayer experience.",903k,2.2k,"Apr 4, 2010"
jailbreak,https://www.reddit.com/r/jailbreak/,"iOS jailbreaking: tweaks, news, and more for jailbroken iPhones, iPads, iPod Touches, and Apple TVs. 

Installed anything great recently? Got an idea for a tweak? Wrote a cool tutorial? Curious about how something works? Let us know!",630k,1.5k,"Sep 29, 2009"
ffxiv,https://www.reddit.com/r/ffxiv/,"A community for fans of the critically acclaimed MMORPG Final Fantasy XIV, which DOES NOT have a free trial that DOES NOT include the entirety of ""A Realm Reborn"" AND the award-winning ""Heavensward"" expansion up to level 60 with no restrictions on playtime.

FFXIV's newest expansion, ""Endwalker"", is out now.",676k,12.1k,"Jan 28, 2010"
askscience,https://www.reddit.com/r/askscience/,"Ask a science question, get a science answer.",21.7m,5.0k,"Sep 5, 2008"
Cooking,https://www.reddit.com/r/Cooking/,"/r/Cooking is a place for the cooks of reddit and those who want to learn how to cook. Post anything related to cooking here, within reason.",2.9m,3.6k,"Jan 25, 2008"
2007scape,https://www.reddit.com/r/2007scape/,"The community for Old School RuneScape discussion on Reddit. Join us for game discussions, tips and tricks, and all things OSRS!

OSRS is the official legacy version of RuneScape, the largest free-to-play MMORPG.",622k,6.8k,"Feb 13, 2013"
LivestreamFail,https://www.reddit.com/r/LivestreamFail/,Welcome to /r/LivestreamFail: the place for almost anything livestream related.,1.3m,16.6k,"Jun 7, 2015"
nfl,https://www.reddit.com/r/nfl/,This is a subreddit for the NFL community.,2.3m,21.6k,"Sep 13, 2008"
cars,https://www.reddit.com/r/cars/,"/r/Cars is the largest automotive enthusiast community on the Internet. We serve as Reddit's central hub for vehicle-related discussion including industry news, reviews, projects, videos, DIY guides, advice, stories, and more.",2.7m,3.5k,"Mar 20, 2008"
pics,https://www.reddit.com/r/pics/,A place for pictures and photographs.,28.4m,19.9k,"Jan 25, 2008"
MonsterHunterWorld,https://www.reddit.com/r/MonsterHunterWorld/,Home for the Monster Hunter: World Reddit community and resource hub...,480k,1.0k,"Jun 10, 2017"
legaladvice,https://www.reddit.com/r/legaladvice/,"A place to ask simple legal questions, and to have legal concepts explained.",1.9m,4.2k,"Oct 26, 2009"
Showerthoughts,https://www.reddit.com/r/Showerthoughts/,A subreddit for sharing those miniature epiphanies you have that highlight the oddities within the familiar.,23.7m,8.4k,"Oct 18, 2011"
pcmasterrace,https://www.reddit.com/r/pcmasterrace/,"Welcome to the official subreddit of the PC Master Race / PCMR. In this community, we celebrate and promote our favorite gaming and working platform. Ascend to a level that respects your eyes, your wallet, your mind, and your heart. Ascend to... the PCMR!",5.6m,6.2k,"Apr 30, 2011"
GooglePixel,https://www.reddit.com/r/GooglePixel/,"The (un)official home of #teampixel and the #madebygoogle lineup on Reddit. Get support, learn new information, and hang out in the subreddit dedicated to Pixel, Nest, Chromecast, the Assistant, and a few more things from Google.",661k,1.5k,"Nov 6, 2015"
cscareerquestions,https://www.reddit.com/r/cscareerquestions/,A subreddit for those with questions about working in the tech industry or in a computer-science-related job.,696k,2.3k,"Mar 19, 2011"
LifeProTips,https://www.reddit.com/r/LifeProTips/,Tips that improve your life in one way or another.,20.0m,13.9k,"Oct 25, 2010"
Music,https://www.reddit.com/r/Music/,The musical community of reddit,28.6m,2.8k,"Jan 25, 2008"
pokemon,https://www.reddit.com/r/pokemon/,"r/pokemon is an unofficial Pokémon fan community. This is the place for most things Pokémon on Reddit—TV shows, video games, toys, trading cards, you name it!",3.7m,5.8k,"Sep 11, 2008"
breakingbad,https://www.reddit.com/r/breakingbad/,"A subreddit for fans and critics of the hit television series Breaking Bad on AMC. Here you will find discussions and speculations about the show, pictures from the show, AMA's with the cast, and anything else Breaking Bad related.",1.5m,505,"Mar 22, 2010"
singapore,https://www.reddit.com/r/singapore/,Welcome to /r/singapore: the reddit home of the country Singapore.,472k,1.4k,"Jan 26, 2008"
AskCulinary,https://www.reddit.com/r/AskCulinary/,"/r/AskCulinary provides expert guidance for your specific cooking problems to help people of all skill levels become better cooks, to increase understanding of cooking, and to share valuable culinary knowledge.",680k,904,"Dec 15, 2011"
FORTnITE,https://www.reddit.com/r/FORTnITE/,"The developer supported, community run subreddit dedicated to Fortnite: Save the World from Epic Games.

Build forts, co-op, kill monsters, save the day, bacon.",542k,755,"Dec 11, 2011"
netflix,https://www.reddit.com/r/netflix/,"Unofficial Netflix discussion, and all things Netflix related! (Mods are not Netflix employees, but employees occasionally post here).",1.2m,666,"Nov 21, 2008"
tipofmytongue,https://www.reddit.com/r/tipofmytongue/,"Can't remember the name of that movie you saw when you were a kid? Or the name of that video game you had for Game Gear? Your Google-fu let you down? This is the place to get help.

Read the rules and suggestions of this subreddit for tips on how to get the most out of TOMT. (Located right side on desktop, varies on mobile.)",1.8m,1.2k,"Aug 12, 2009"
pokemongo,https://www.reddit.com/r/pokemongo/,Welcome to pokemongo,3.5m,1.8k,"Nov 14, 2014"
Philippines,https://www.reddit.com/r/Philippines/,A subreddit for the Philippines and all things Filipino!,753k,2.4k,"Jul 4, 2008"
DotA2,https://www.reddit.com/r/DotA2/,"/r/DotA2 is the most popular English-speaking community to discuss gameplay, esports, and news related to Valve's award winning free-to-play MOBA DotA 2.",988k,3.9k,"Oct 13, 2010"
nvidia,https://www.reddit.com/r/nvidia/,"A place for everything NVIDIA, come talk about news, drivers, rumors, GPUs, the industry, show-off your build and more.

This Subreddit is community run and does not represent NVIDIA in any capacity unless specified.",1.1m,1.3k,"Mar 17, 2010"
books,https://www.reddit.com/r/books/,"This is a moderated subreddit. It is our intent and purpose to foster and encourage in-depth discussion about all things related to books, authors, genres, or publishing in a safe, supportive environment. If you're looking for help with a personal book recommendation, consult our Weekly Recommendation Thread, Suggested Reading page, or ask in r/suggestmeabook.",20.2m,3.1k,"Jan 25, 2008"
DunderMifflin,https://www.reddit.com/r/DunderMifflin/,Why waste time watch many show when one show do trick?,1.9m,4.0k,"Jan 8, 2011"
memes,https://www.reddit.com/r/memes/,"Memes!

A way of describing cultural information being shared.
An element of a culture or system of behavior that may be considered to be passed from one individual to another by nongenetic means, especially imitation.",17.3m,25.5k,"Jul 5, 2008"
SquaredCircle,https://www.reddit.com/r/SquaredCircle/,"Reddit's largest professional wrestling community.  Join us to discuss WWE, AEW, NJPW, ChocoPro, Impact, GCW, Stardom and every other promotion, past and present.",595k,10.4k,"Jun 28, 2011"
headphones,https://www.reddit.com/r/headphones/,"A place for discussion, news, reviews and DIY projects related to portable audio, headphones, headphone amplifiers and DACs.",770k,1.1k,"Nov 19, 2009"
baseball,https://www.reddit.com/r/baseball/,"The subreddit for the bat-and-ball sport played between two teams of nine players. America's Pastime.

Mike Trout


**For the best user experience, we recommend disabling the Reddit redesign.**",1.7m,2.5k,"Sep 7, 2008"
learnpython,https://www.reddit.com/r/learnpython/,Subreddit for posting questions and asking for general advice about your python code.,581k,731,"Oct 2, 2009"
Rainbow6,https://www.reddit.com/r/Rainbow6/,"Welcome to the Rainbow Six subreddit, a community for R6 fans to discuss Rainbow Six Siege and past favorites.",1.5m,1.7k,"Oct 27, 2011"
keto,https://www.reddit.com/r/keto/,"The Ketogenic Diet is a low carbohydrate method of eating. /r/keto is place to share thoughts, ideas, benefits, and experiences around eating within a Ketogenic lifestyle.

Helping people with diabetes, epilepsy, autoimmune disorders, acid reflux, inflammation, hormonal imbalances, and a number of other issues, every day.",2.8m,1.1k,"May 27, 2010"
hearthstone,https://www.reddit.com/r/hearthstone/,"For fans of Blizzard Entertainment's digital card game, Hearthstone",1.8m,1.6k,"Jan 17, 2013"
Windows10,https://www.reddit.com/r/Windows10/,"This community is dedicated to Windows 10, which is a personal computer operating system released by Microsoft as part of the Windows NT family of operating systems.",405k,760,"Jun 12, 2012"
Android,https://www.reddit.com/r/Android/,"Android news, reviews, tips, and discussions about rooting, tutorials, and apps. Generic discussion about phones/tablets is allowed, but technical-support, upgrade related questions or buy/sell posts, app recommendations and carrier-related issues should be asked in their respective subreddits!",2.3m,1.3k,"Aug 27, 2008"
Sneakers,https://www.reddit.com/r/Sneakers/,A subreddit for sneaker lovers.,2.4m,2.0k,"Jan 21, 2009"
Frugal,https://www.reddit.com/r/Frugal/,"Frugality is the mental approach we each take when considering our resource allocations. It includes time, money, convenience, and many other factors.",2.1m,1.5k,"Mar 3, 2008"
fantasyfootball,https://www.reddit.com/r/fantasyfootball/,/r/fantasyfootball - Good For Your Season,808k,3.5k,"Aug 27, 2008"
starbucks,https://www.reddit.com/r/starbucks/,"The cyber third place for Starbucks friends, fans, and families alike! Please sit back, get yourself a beverage, and enjoy your stay. On behalf of all partners on /r/Starbucks, the views expressed here are ours alone and do not necessarily reflect the views of our employer. An unofficial Starbucks community.",207k,1.6k,"Apr 20, 2009"
Steam,https://www.reddit.com/r/Steam/,A subreddit for members of the Steam Community.,1.2m,2.4k,"Apr 12, 2009"
learnprogramming,https://www.reddit.com/r/learnprogramming/,A subreddit for all questions related to programming in any language.,2.7m,1.6k,"Sep 24, 2009"
Overwatch,https://www.reddit.com/r/Overwatch/,"Subreddit for all things Overwatch™, the team-based shooter from Blizzard Entertainment.",3.7m,2.7k,"May 24, 2012"
pathofexile,https://www.reddit.com/r/pathofexile/,"A subreddit dedicated to Path of Exile, an ARPG made by Grinding Gear Games. Spiritual successor to Diablo 2",466k,3.3k,"Apr 8, 2011"
confession,https://www.reddit.com/r/confession/,"/r/Confession is a place to admit your wrongdoings, acknowledge your guilt, and alleviate your conscience.",2.9m,1.1k,"Nov 2, 2008"
southpark,https://www.reddit.com/r/southpark/,Welcome to southpark,1.3m,1.0k,"Nov 18, 2008"
RedDeadOnline,https://www.reddit.com/r/RedDeadOnline/,"A subreddit for the Online portion of the critically acclaimed video game Red Dead Redemption 2, developed by Rockstar Games",339k,1.4k,"Jun 4, 2016"
piercing,https://www.reddit.com/r/piercing/,Almost anything involving poking holes in flesh with sharp metal.,375k,1.3k,"Nov 14, 2008"
canada,https://www.reddit.com/r/canada/,"Welcome to, et bienvenue à, r/Canada!

We are Canada’s general-theme subreddit. This is the place to post news, show off your photos, and discuss issues relating to Canada. Our subreddit is nonpartisan; we aim to foster lively discussion while respecting our nation’s diverse range of perspectives.",1.1m,5.1k,"Jan 25, 2008"
HomeImprovement,https://www.reddit.com/r/HomeImprovement/,"A community dedicated to helping people with advice on personal home improvement projects. If you are new here, please review posting/commenting guidelines below.",2.5m,2.2k,"Aug 18, 2008"
skyrim,https://www.reddit.com/r/skyrim/,A subreddit dedicated to the Elder Scrolls V: Skyrim.,1.2m,4.1k,"Dec 12, 2010"
jobs,https://www.reddit.com/r/jobs/,"We aim to empower job seekers and employees through the promotion of their best interests, advice and encouragement.

Check out our discord here: https://discord.com/invite/TY6ErXV

We are not for job listings.",639k,1.7k,"Mar 25, 2008"
worldnews,https://www.reddit.com/r/worldnews/,"A place for major news from around the world, excluding US-internal news.",27.5m,20.7k,"Jan 25, 2008"
nosleep,https://www.reddit.com/r/nosleep/,"Nosleep is a place for redditors to share their scary personal experiences. Please read our guidelines in the sidebar/""about"" section before proceeding.",15.2m,1.6k,"Mar 24, 2010"
StardewValley,https://www.reddit.com/r/StardewValley/,Stardew Valley is an open-ended country-life RPG with support for 1–4 players. (Multiplayer isn't supported on mobile).,984k,3.3k,"Feb 12, 2013"
FortniteCompetitive,https://www.reddit.com/r/FortniteCompetitive/,"The developer supported, community-run subreddit dedicated to the Fortnite: Battle Royale game mode by Epic Games. Tailored for those who want to keep up to date on the pro scene, tournaments, competitive plays and figure out new tips/tricks on how to play the current meta.",527k,386,"Jan 8, 2018"
Warframe,https://www.reddit.com/r/Warframe/,"Reddit community and fansite for the free-to-play third-person co-op action shooter, Warframe. The game is currently in open beta on PC, PlayStation 4 & 5, Xbox One & Series X/S, and Nintendo Switch.",545k,3.1k,"Aug 14, 2012"
totalwar,https://www.reddit.com/r/totalwar/,"A subreddit for the Total War strategy game series, made by Creative Assembly.

Discussions, strategies, stories, crude cave-drawings, and more for Medieval 2, Empire, Shogun 2, Rome 2, Attila, Thrones of Britannia, Warhammer, Three Kingdoms and others.",330k,2.7k,"May 3, 2010"
Fallout,https://www.reddit.com/r/Fallout/,A state-of-the-art subreddit from Vault-Tec.,853k,1.3k,"Oct 31, 2008"
RocketLeague,https://www.reddit.com/r/RocketLeague/,"The official home of Rocket League on Reddit! Join the community for Rocket League news, discussion, highlights, memes, and more!",1.1m,2.7k,"Feb 14, 2014"
fo76,https://www.reddit.com/r/fo76/,Welcome to the Fallout Network subreddit for Fallout 76,334k,1.8k,"May 29, 2018"
yugioh,https://www.reddit.com/r/yugioh/,"The subreddit for players of the Yu-Gi-Oh! card game, video games, or fans of the Yu-Gi-Oh! anime series or manga. Discuss tactics, episodes, decks, or whatever you'd like.",254k,1.3k,"Apr 25, 2010"
eu4,https://www.reddit.com/r/eu4/,"A place to share content, ask questions and/or talk about the grand strategy game Europa Universalis IV by Paradox Development Studio.",275k,1.5k,"Aug 10, 2012"
smashbros,https://www.reddit.com/r/smashbros/,Welcome to Reddit's finest Smash Bros. community!,878k,1.3k,"Jun 2, 2008"
thesims,https://www.reddit.com/r/thesims/,The official subreddit for The Sims franchise,474k,1.0k,"Oct 31, 2009"
ClashRoyale,https://www.reddit.com/r/ClashRoyale/,"Subreddit for all things Clash Royale, the free mobile strategy game from Supercell.",586k,2.0k,"Jan 4, 2016"
boardgames,https://www.reddit.com/r/boardgames/,"The #1 reddit source for news, information, and discussion about modern board games and board game culture.  

Join our community! Come discuss games like Codenames, Arkham Horror, Terra Mystica, and all your other favorite games!",3.5m,1.6k,"Sep 16, 2008"
thedivision,https://www.reddit.com/r/thedivision/,The unofficial home for discussing Tom Clancy's The Division and The Division 2; online RPGs from Ubisoft and Massive Entertainment.,354k,720,"Jun 10, 2013"
elderscrollsonline,https://www.reddit.com/r/elderscrollsonline/,"A Reddit community dedicated to The Elder Scrolls Online, an MMO developed by Zenimax Online.",368k,1.6k,"Mar 16, 2012"
runescape,https://www.reddit.com/r/runescape/,A subreddit dedicated to the MMORPG RuneScape. Join us!,294k,2.3k,"Apr 19, 2009"
Blackops4,https://www.reddit.com/r/Blackops4/,"Call of Duty: Black Ops 4 is a first-person shooter video game developed by Treyarch and published by Activision.

r/BlackOps4 is a developer-recognized community focused on the title.",276k,319,"Aug 2, 2012"
grandorder,https://www.reddit.com/r/grandorder/,"Welcome to r/grandorder, the hub of all FGO and Type Moon related content. 

Happy New Years!",266k,2.2k,"Jul 31, 2015"
fireemblem,https://www.reddit.com/r/fireemblem/,"A subreddit to discuss the Fire Emblem series of games, and associated media.

Fire Emblem is a fantasy tactical role-playing video game franchise developed by Intelligent Systems and published by Nintendo. The Fire Emblem series is well known for its innovation and for being one of the first Eastern style tactical role-playing games, with a strong emphasis on Western forms of medieval folklore. The series currently spans 16 games, two crossover titles, and a mobile game.",277k,817,"Oct 21, 2011"
CrusaderKings,https://www.reddit.com/r/CrusaderKings/,"Crusader Kings is a historical grand strategy / RPG video game series for PC, Mac & Linux developed & published by Paradox Interactive. Engage in courtly intrigue, dynastic struggles, and holy warfare in mediæval Europe, North Africa, the Middle East, India, the steppes and Tibet. Can you achieve fame and fortune for your noble family, or will your names be forgotten to history?",328k,1.5k,"Jan 28, 2012"
Breath_of_the_Wild,https://www.reddit.com/r/Breath_of_the_Wild/,All things The Legend of Zelda: Breath of the Wild series! | | | | discord.gg/botw,799k,1.7k,"Jun 14, 2016"
