Topic Names,Topic Urls,Topic Description,Followers,Active,Created Date
PUBGMobile,https://www.reddit.com/r/PUBGMobile/,OFFICIAL SUBREDDIT FOR PLAYERUNKNOWN'S BATTLEGROUNDS MOBILE VERSION DEVELOPED BY TENCENT FOR BOTH IOS AND ANDROID.,184k,199,"Nov 27, 2017"
Warhammer40k,https://www.reddit.com/r/Warhammer40k/,"Warhammer 40k is a franchise created by Games Workshop, detailing the far future and the grim darkness it holds. The main attraction of 40k is the miniatures, but there are also many video games, board games, books, ect. that are all connected in the 40k universe. This subreddit is for anything and everything related to Warhammer 40k",451k,2.4k,"May 13, 2010"
Stellaris,https://www.reddit.com/r/Stellaris/,"A place to share content, ask questions and/or talk about the 4X grand strategy game Stellaris by Paradox Development Studio.",319k,2.1k,"Jul 31, 2015"
DBZDokkanBattle,https://www.reddit.com/r/DBZDokkanBattle/,"Everything Dragon Ball Z: Dokkan Battle! This subreddit is for both the Japanese and Global version. Information, guides, tips, news, fan art, questions and everything else Dokkan Battle related.",216k,1.3k,"May 6, 2015"
Brawlstars,https://www.reddit.com/r/Brawlstars/,"Subreddit for all things Brawl Stars, the free multiplayer mobile arena fighter/party brawler/shoot 'em up game from Supercell. Fast-paced 3v3 and Battle Royale matches 🔥 Collect unique Brawlers. Play with your friends. Be the last one standing!",578k,1.6k,"Apr 28, 2017"
EscapefromTarkov,https://www.reddit.com/r/EscapefromTarkov/,"The unofficial Subreddit for Escape From Tarkov, a Hardcore FPS being created by Battlestate Games.",715k,8.6k,"Nov 9, 2015"
summonerswar,https://www.reddit.com/r/summonerswar/,"Subreddit for mobile game Summoners War: Sky Arena. Discuss the latest gameplay, news and events with fellow summoners around the globe.",124k,748,"Jun 10, 2014"
MLBTheShow,https://www.reddit.com/r/MLBTheShow/,"The subreddit for all who want to share and talk about their experiences with MLB: The Show. So go ahead; share your Diamond Dynasty triumphs, your Road to the Show career, or tell us how you plan on taking your franchise to the Fall Classic!",151k,886,"Feb 11, 2012"
SWGalaxyOfHeroes,https://www.reddit.com/r/SWGalaxyOfHeroes/,"Star Wars: Galaxy of Heroes is a mobile game by EA Capital Games where players collect, level and battle with heroes and villains from the Star Wars universe.",104k,841,"Sep 7, 2015"
BattlefieldV,https://www.reddit.com/r/BattlefieldV/,"Welcome to the home of Battlefield V!  

Your place for discussion, help, news, reviews, questions, screenshots, videos, gifs, and anything else BFV related!

Battlefield V is developed by DICE and produced by EA.

This subreddit is ran by dedicated fans of the series and has no affiliation with EA or DICE.",240k,437,"Sep 2, 2012"
deadbydaylight,https://www.reddit.com/r/deadbydaylight/,"Dead by Daylight is an asymmetrical multiplayer horror game developed and published by Behaviour Interactive.  Check the Sidebar or About tab for news, patch notes, and upcoming events.",559k,3.9k,"Feb 4, 2016"
MagicArena,https://www.reddit.com/r/MagicArena/,The subreddit for anything concerning the Magic the Gathering: Arena!,240k,1.1k,"Aug 3, 2017"
Smite,https://www.reddit.com/r/Smite/,"Smite is a third-person multiplayer online battle arena video game developed and published by Hi-Rez Studios on PC, XBox, Playstation, and Switch.",377k,1.4k,"Sep 2, 2011"
PUBATTLEGROUNDS,https://www.reddit.com/r/PUBATTLEGROUNDS/,"The largest community for PUBG: BATTLEGROUNDS on PC, Xbox, PlayStation and Stadia. A central place for discussion, media, news, developer interaction and more.",1.8m,450,"Jul 26, 2016"
starcitizen,https://www.reddit.com/r/starcitizen/,This is the subreddit for everything related to Star Citizen - an up and coming epic space sim MMO being developed by Chris Roberts and Cloud Imperium Games.,273k,2.0k,"Oct 10, 2012"
Persona5,https://www.reddit.com/r/Persona5/,"Subreddit Community for Persona 5 and other P5/Persona products!

Please be courteous and mark any and all spoilers.
 
Persona 5 is a role-playing game by ATLUS in which players live out a year in the life of a high school boy who gains the ability to summon facets of his psyche, known as Personas.",337k,1.3k,"Nov 26, 2012"
MortalKombat,https://www.reddit.com/r/MortalKombat/,"/r/MortalKombat is the developer supported, kommunity-run subreddit for the Mortal Kombat franchise. 

r/Mortal Kombat is the biggest Mortal Kombat fan resource on the internet, covering a wide range of MK culture and a premier destination for Mortal Kombat gameplay discussion, both casual and competitive!

Mortal Kombat is the iconic fighting game franchise created by NetherRealm Studios, a Warner Bro’s Games studio.",269k,634,"Apr 15, 2010"
tf2,https://www.reddit.com/r/tf2/,"This subreddit is dedicated to Team Fortress 2, created by Valve Corporation in 2007.  After nine years in development, hopefully it was worth the wait.",689k,2.3k,"Jul 19, 2008"
playrust,https://www.reddit.com/r/playrust/,"The largest community for the game RUST. A central place for discussion, media, news and more. Mostly PC users, for console Rust please use r/RustConsole.",445k,1.3k,"Jun 16, 2013"
PSVR,https://www.reddit.com/r/PSVR/,"A place to share your love for and discuss everything PlayStation VR.

AKA PSVR, PS VR, PlayStationVR and formerly Project Morpheus.

---

• News, AMAs with Developers • Tournaments • Reviews • Events • Giveaways • Support • Deals • Game Discussions • PSN friends • Humour",177k,476,"Mar 19, 2014"
Guildwars2,https://www.reddit.com/r/Guildwars2/,Welcome to /r/GuildWars2 where we strive to be a place where you can share your Guild Wars 2 experiences and partake in discussions with players from around the world.,290k,1.4k,"Oct 13, 2009"
RimWorld,https://www.reddit.com/r/RimWorld/,"Discussion, screenshots, and links, get all your RimWorld content here!",339k,4.1k,"Sep 19, 2013"
ClashOfClans,https://www.reddit.com/r/ClashOfClans/,"Welcome to the subreddit dedicated to the mobile strategy game Clash of Clans! Join the community for Clash of Clans news, discussions, highlights, memes, and more!",404k,1.3k,"Aug 17, 2012"
DMAcademy,https://www.reddit.com/r/DMAcademy/,"/r/DMAcademy is a subreddit for Dungeons & Dragons Dungeon Masters to ask questions - new and experienced, all are welcome. A casual, friendly place for the lovers of DnD (D&D). Welcome Wanderer!",475k,956,"Jun 23, 2016"
MarvelStrikeForce,https://www.reddit.com/r/MarvelStrikeForce/,"The subreddit for MARVEL Strike Force, a game for iOS/Android that is published by Scopely. Feel free to browse the latest game news, discussions, strategy, and quality creator content that our community offers. Happy gaming!",92.7k,669,"Nov 20, 2017"
FireEmblemHeroes,https://www.reddit.com/r/FireEmblemHeroes/,"A subreddit dedicated to Fire Emblem Heroes, Nintendo's 3rd mobile title released on February 2nd, 2017. The game is available worldwide on iOS and Android.",182k,2.1k,"Jan 18, 2017"
EDH,https://www.reddit.com/r/EDH/,The premiere source for Commander news!,174k,1.5k,"Feb 25, 2011"
Terraria,https://www.reddit.com/r/Terraria/,"Dig, fight, explore, build! Nothing is impossible in this action-packed adventure game. The world is your canvas and the ground itself is your paint.",904k,2.0k,"Apr 23, 2011"
osugame,https://www.reddit.com/r/osugame/,osu! is a rhythm game based on the gameplay of a variety of popular commercial rhythm games such as Osu! Tatakae! Ouendan and Elite Beat Agents.,281k,1.1k,"Sep 6, 2010"
NoMansSkyTheGame,https://www.reddit.com/r/NoMansSkyTheGame/,"The unofficial subreddit for the discussion of No Man's Sky, a fantasy science-fiction game set in an infinite, procedurally-generated universe.",651k,1.4k,"Jun 12, 2014"
forhonor,https://www.reddit.com/r/forhonor/,"The Home of For Honor on Reddit!

For Honor is a Third-Person Fighting Game, developed and published by Ubisoft for Windows PC, PlayStation 4 and Xbox One.",365k,796,"Jun 15, 2015"
EliteDangerous,https://www.reddit.com/r/EliteDangerous/,"The official unofficial subreddit for Elite Dangerous, we even have devs lurking the sub!

Elite Dangerous is a space simulator game by Frontier Developments based in the year 3308. Your CMDR flies spaceships and participates in exploring a 1:1 scale Milky Way, trade between star systems, bounty-hunting wanted ships, discover alien lifeforms, and even pirate other ships for their cargo.",312k,1.4k,"Nov 8, 2012"
Warthunder,https://www.reddit.com/r/Warthunder/,"This is a subreddit for War Thunder, a cross platform vehicular combat MMO developed by Gaijin Entertainment for Microsoft Windows, macOS, Linux, PlayStation 4, PlayStation 5, Xbox One and Xbox Series X|S. The game is based around combined arms battles on air, land, and sea with vehicles from the Great War to today.",275k,1.8k,"Jun 20, 2012"
Seaofthieves,https://www.reddit.com/r/Seaofthieves/,"Sea of Thieves is an action-adventure free-roaming pirate video game developed by Rare and published by Microsoft Studios for Windows 10, Xbox Series S/X, and Xbox One.",422k,1.0k,"Jun 15, 2015"
Paladins,https://www.reddit.com/r/Paladins/,"The subreddit of Paladins: Champions of the Realm, a free-to-play, competitive multiplayer, first person shooter for Windows, PlayStation 4, Xbox, and Nintendo Switch, developed by Evil Mojo Games and published by Hi-Rez Studios.",278k,380,"Oct 6, 2012"
StarWarsBattlefront,https://www.reddit.com/r/StarWarsBattlefront/,"The subreddit dedicated to the discussion of the Star Wars: Battlefront franchise, including the entries by both EA DICE and Pandemic Studios.",397k,739,"Jun 11, 2012"
dauntless,https://www.reddit.com/r/dauntless/,"Play Dauntless for free on Playstation 4|5, Xbox Series X|S, Xbox One, Nintendo Switch, and the Epic Games store with true cross-play and cross-progression.

Battle ferocious Behemoths, craft powerful weapons, and forge your legend in the Shattered Isles!",117k,148,"Nov 23, 2012"
FFBraveExvius,https://www.reddit.com/r/FFBraveExvius/,Final Fantasy Brave Exvius is a free-to-play role-playing game developed by Alim and published by Square Enix for iOS and Android devices.,82.1k,334,"Nov 18, 2014"
TwoBestFriendsPlay,https://www.reddit.com/r/TwoBestFriendsPlay/,"A place where fans of the content that Matt, Pat, and Woolie provide come to talk about their content and anything revolving around that.",86.2k,1.7k,"Sep 7, 2012"
Competitiveoverwatch,https://www.reddit.com/r/Competitiveoverwatch/,"A place for in-depth discussions of Competitive Overwatch™ (the team-based shooter from Blizzard Entertainment). Find detailed discussion of meta, esports and events as well as guides, advice, and tips that go beyond the basics.",277k,707,"Nov 7, 2014"
DuelLinks,https://www.reddit.com/r/DuelLinks/,"Yu-Gi-Oh! Duel Links is a game developed by Konami, available to Mobile and PC on Android, iOS and Windows, distributed with Play/App Store & Steam.",137k,764,"Sep 7, 2016"
Eve,https://www.reddit.com/r/Eve/,/r/EVE is a place to discuss internet spaceships,164k,1.0k,"Jun 7, 2008"
danganronpa,https://www.reddit.com/r/danganronpa/,Danganronpa is a Japanese visual novel franchise created by Kazutaka Kodaka and published by Spike Chunsoft since 2010.,287k,2.0k,"Feb 14, 2013"
halo,https://www.reddit.com/r/halo/,"Reddit's home for all things Halo, the video game series developed by 343 Industries and previously developed by Bungie | https://discord.gg/rhalo",1.1m,9.6k,"Jun 17, 2008"
Destiny,https://www.reddit.com/r/Destiny/,"Hub for all things Destiny (the streamer, not the game).",132k,1.9k,"Oct 27, 2008"
heroesofthestorm,https://www.reddit.com/r/heroesofthestorm/,Reddit community for Blizzard's MOBA game - Heroes of the Storm,335k,410,"Sep 25, 2013"
pesmobile,https://www.reddit.com/r/pesmobile/,r/PESMobile - The home of all discussion about the most authentic football game for mobile devices.,50.0k,234,"Sep 17, 2016"
AnthemTheGame,https://www.reddit.com/r/AnthemTheGame/,"Our subreddit discusses BioWare's game, Anthem: an online multiplayer action role-playing video game, in which you pilot combat suits known as Javelins in a primeval, alien world.",157k,149,"Jun 10, 2017"
CoDCompetitive,https://www.reddit.com/r/CoDCompetitive/,"Welcome to /r/CoDCompetitive, the home of Call of Duty esports fans and competitive players. If you're passionate about the players and teams in the Call of Duty League, climbing Gamebattles ladders, or just playing with friends in League Play, this is the place for you.",161k,662,"Apr 9, 2012"
future_fight,https://www.reddit.com/r/future_fight/,Area meant for discussion of Netmarble Games and Marvel’s Future Fight.,60.1k,195,"Jun 1, 2016"
DaysGone,https://www.reddit.com/r/DaysGone/,"Subreddit for Days Gone, developed by Bend Studio. Hit the broken road with us to share, discuss and catch all the latest news.",78.6k,239,"Jan 4, 2016"
ModernMagic,https://www.reddit.com/r/ModernMagic/,A subreddit dedicated to the discussion of Magic: The Gathering's Modern format!,90.2k,408,"Jul 6, 2013"
girlsfrontline,https://www.reddit.com/r/girlsfrontline/,Girls Frontline (少女前線) is a Chinese mobile game developed by Mica Team,90.4k,463,"Aug 4, 2016"
fivenightsatfreddys,https://www.reddit.com/r/fivenightsatfreddys/,"Official subreddit for the horror franchise known as Five Nights at Freddy's (FNaF).

|| Official Discord Server: https://discord.gg/fnaf",363k,2.7k,"Aug 14, 2014"
GlobalOffensiveTrade,https://www.reddit.com/r/GlobalOffensiveTrade/,"Buy, sell, and trade CS:GO items. Register for RUGC Flair by reading our subreddit rules (https://www.reddit.com/r/GlobalOffensiveTrade/wiki/rules) to begin trading.",223k,278,"Aug 13, 2013"
WorldOfWarships,https://www.reddit.com/r/WorldOfWarships/,"A game about huge boats. With guns. Gunboats. Never submarines, they said.

What have we done to deserve this, Wargaming?",104k,531,"Dec 20, 2011"
NHLHUT,https://www.reddit.com/r/NHLHUT/,The official subreddit for the Hockey Ultimate Team game mode of EA Sports NHL 22.,51.4k,439,"Oct 5, 2013"
WorldofTanks,https://www.reddit.com/r/WorldofTanks/,"World of Tanks is a PvP MMO game created by international game developer Wargaming. We're Redditors with a passion for gaming, tanks, and everything in between! This is a subreddit where we share WoT news, strategy tips, tank choices, and opinions. We have a number of affiliated clans on the NA, EU, and ASIA servers for all levels of game experience.  

Come join the conversation!",120k,844,"Aug 13, 2010"
Gamingcirclejerk,https://www.reddit.com/r/Gamingcirclejerk/,Do you guys remember The Witcher 3?,506k,1.9k,"Apr 6, 2011"
dndmemes,https://www.reddit.com/r/dndmemes/,DnDMemes is a subreddit dedicated to memes and other humorous content about Dungeons and Dragons and other TTRPGs.,911k,3.8k,"Dec 17, 2014"
Mordhau,https://www.reddit.com/r/Mordhau/,"MORDHAU is a multiplayer medieval slasher. Create your mercenary and fight in brutal battles where you will experience fast paced combat, castle sieges, cavalry charges, and more.",98.3k,338,"May 14, 2015"
battlestations,https://www.reddit.com/r/battlestations/,A subreddit for reddit users' battlestation pictures.,2.6m,1.1k,"Nov 25, 2009"
Planetside,https://www.reddit.com/r/Planetside/,"Subreddit for the Planetside Franchise, a series of games developed by Rogue Planet Games and published by Daybreak Games",78.3k,290,"Sep 21, 2010"
FUTMobile,https://www.reddit.com/r/FUTMobile/,"Welcome to the FUTMobile Subreddit! We are here to provide all FIFA Mobile players a place to get news, find strategies, chat, find leagues to join, and make everlasting friends.",52.7k,143,"Mar 4, 2015"
Grimdank,https://www.reddit.com/r/Grimdank/,Your central hub for the dankest memes from the 41st millennium and the Mortal Realms,240k,2.2k,"Jan 17, 2017"
mw4,https://www.reddit.com/r/mw4/,"Call of Duty: Modern Warfare.

Going Dark.

Read the rules before posting.  

Similar subreddits:  /r/MWLoadouts",53.8k,160,"Dec 13, 2010"
Market76,https://www.reddit.com/r/Market76/,"Fallout 76's 1st Public market—A Trading Reddit for in-game caps, items, and services. Happy trading!",102k,717,"Aug 16, 2018"
RocketLeagueExchange,https://www.reddit.com/r/RocketLeagueExchange/,"Subreddit for all kinds of Rocket League cosmetic item trades.

Use Creator Code: RLExchange #Ad",188k,194,"Sep 2, 2016"
pokemontrades,https://www.reddit.com/r/pokemontrades/,"/r/pokemontrades is a trading community focusing on legitimate Pokémon. We are one of the few large Pokémon trading communities with a policy of no hacks, no clones!",432k,671,"Mar 30, 2010"
running,https://www.reddit.com/r/running/,All runners welcome.,1.6m,1.4k,"Aug 26, 2008"
soccer,https://www.reddit.com/r/soccer/,"The football subreddit. 

News, results and discussion about the beautiful game.",3.1m,15.4k,"May 27, 2008"
bjj,https://www.reddit.com/r/bjj/,"Brazilian Jiu-Jitsu (BJJ) is a martial art that focuses on grappling and ground fighting. /r/bjj is for discussing BJJ training, techniques, news, competition, asking questions and getting advice. Beginners are welcome. Discussion is encouraged.",402k,953,"Sep 29, 2008"
MMA,https://www.reddit.com/r/MMA/,A subreddit for all things Mixed Martial Arts.,1.8m,3.8k,"Mar 17, 2008"
hockey,https://www.reddit.com/r/hockey/,"Discuss the NHL, AHL, KHL, NWHL, IIHF and every other hockey league you can think of!

We are the premiere subreddit to talk everything hockey!",1.3m,4.3k,"Jun 2, 2008"
formula1,https://www.reddit.com/r/formula1/,"The best independent Formula 1 community anywhere. News, stories and discussion from and about the world of Formula 1.",1.8m,7.6k,"Jun 8, 2008"
CFB,https://www.reddit.com/r/CFB/,The home of college football on reddit.,1.3m,5.5k,"Sep 9, 2008"
barstoolsports,https://www.reddit.com/r/barstoolsports/,"The official Barstoolsports.com subreddit. This is Barstool Sports. 

By the Common Man, For the Common Man. Viva la Stool.",170k,1.9k,"Jan 31, 2012"
airsoft,https://www.reddit.com/r/airsoft/,"For all things airsoft. Please read the rules, Wiki/FAQ, and use the search bar!",230k,1.1k,"May 27, 2008"
rugbyunion,https://www.reddit.com/r/rugbyunion/,"Rugby Union news, analysis and opinions.",165k,393,"Jul 21, 2008"
golf,https://www.reddit.com/r/golf/,Welcome to golf,434k,3.7k,"Mar 8, 2008"
MTB,https://www.reddit.com/r/MTB/,A cycling community enthusiastic about mountain biking and all things related.,261k,461,"Nov 3, 2008"
cycling,https://www.reddit.com/r/cycling/,"Discussion of everything bicycle related.

bikeit!

bike
bikes
bicycle
bicycles
bicycling
cycling",238k,546,"May 10, 2008"
climbing,https://www.reddit.com/r/climbing/,The home of Climbing on reddit. And yes we are scared of falling.,1.0m,424,"Jul 17, 2008"
Boxing,https://www.reddit.com/r/Boxing/,"Welcome to r/boxing, the official home of pro boxing on Reddit! Be respectful and come chat with us. Please read the rules before posting/commenting. 

r/boxing does not tolerate racism or intolerance of any kind. This is a place for friendly and civil debate about the greatest sport on earth.",1.1m,1.0k,"Jun 18, 2008"
bicycling,https://www.reddit.com/r/bicycling/,"Two wheels, or three, sometimes one, but never more than twenty.


Interested in riding a bicycle? We welcome bicyclists of all skill levels including those who don't yet own a bike. Ask us your questions or meetup with other redditors in your area for local rides. 


Happy cycling!",1.0m,625,"May 22, 2008"
sportsbook,https://www.reddit.com/r/sportsbook/,"sports betting ""discussion""",256k,1.3k,"Sep 12, 2010"
hockeyplayers,https://www.reddit.com/r/hockeyplayers/,"This is a subreddit for hockey players and coaches. The posts should be about playing hockey, improving your skills, coaching hockey and general discussion of the game.",83.8k,423,"Dec 12, 2012"
NewSkaters,https://www.reddit.com/r/NewSkaters/,"A place for new skateboarders to ask questions on basic gear, setup, anything they want. One rule, don't be a dick.",167k,310,"Mar 17, 2012"
Astros,https://www.reddit.com/r/Astros/,Home of the MLB Houston Astros,67.5k,62,"Nov 18, 2010"
footballmanagergames,https://www.reddit.com/r/footballmanagergames/,"One of the largest Football Manager Communities/Forums on the internet. If it is about Football Manager, then it belongs here!",229k,1.4k,"Aug 12, 2010"
WWEGames,https://www.reddit.com/r/WWEGames/,The unofficial hub for discussion of the WWE2K series and any other pro wrestling game out there!,85.7k,269,"Dec 23, 2011"
Nationals,https://www.reddit.com/r/Nationals/,"Subreddit for fans and followers of the Washington Nationals, a team in Major League Baseball. Formerly the Montreal Expos, but now based in Washington, D.C., the Nats play in the National League East. 

Polite fans of other teams are always welcome to join the discussions here.

**For the best user experience, we recommend disabling the Reddit redesign.**",42.9k,38,"Jan 6, 2011"
GreenBayPackers,https://www.reddit.com/r/GreenBayPackers/,Home of the Green Bay Packers Subreddit,231k,1.3k,"Dec 23, 2008"
Patriots,https://www.reddit.com/r/Patriots/,Welcome to the Reddit home of the 6-time Super Bowl Champion New England Patriots of the National Football League.,610k,1.3k,"Jul 12, 2010"
sports,https://www.reddit.com/r/sports/,"Sports News and Highlights from the NFL, NBA, NHL, MLB, MLS, and leagues around the world.",19.6m,4.7k,"Sep 17, 2007"
lakers,https://www.reddit.com/r/lakers/,"The home of the 17x NBA World Champions, your Los Angeles Lakers.",307k,1.1k,"Apr 25, 2008"
reddevils,https://www.reddit.com/r/reddevils/,The Home of all things Manchester United on Reddit,327k,2.3k,"Jul 17, 2010"
torontoraptors,https://www.reddit.com/r/torontoraptors/,A subreddit for fans of the 2018-19 NBA Champion Toronto Raptors.,315k,1.0k,"Oct 27, 2010"
LiverpoolFC,https://www.reddit.com/r/LiverpoolFC/,"A subreddit for news and discussion about Liverpool FC, a football club playing in the English Premier League. Liverpool are one of the most decorated football clubs in all of world football, with 19 English League Titles and 6 European Cups.",336k,1.8k,"Sep 29, 2008"
NYYankees,https://www.reddit.com/r/NYYankees/,Subreddit for the New York Yankees,122k,279,"Apr 21, 2010"
tennis,https://www.reddit.com/r/tennis/,Tennis News & Discussion,739k,4.9k,"Jun 11, 2008"
FantasyPL,https://www.reddit.com/r/FantasyPL/,"A place where people can discuss Premier League Fantasy Football Teams,  News, or anything else that might be helpful for fantasy managers.",528k,1.9k,"Jul 21, 2011"
49ers,https://www.reddit.com/r/49ers/,A community for fans of the San Francisco 49ers. Go Niners!,165k,738,"Dec 15, 2009"
WWE,https://www.reddit.com/r/WWE/,"Welcome to r/WWE

A SubReddit to discuss WWE, NXT, ECW, and WCW.",221k,525,"Oct 25, 2009"
Dodgers,https://www.reddit.com/r/Dodgers/,"Reddit community for /u/probablysmellsmydog and fans of the 2021 NLDS Champion, 2013-2021 Attendance Champion, 2021 NLCS Runners-Up, 112-Game Winning, 2022 All Star Game Host, Birthplace of Joctober Los Angeles Dodgers.",104k,265,"Oct 16, 2009"
NFA,https://www.reddit.com/r/NFA/,"A community of hobbyists interested in NFA items, topics, history, and news. We seek to expand general understanding of the laws collectively referred to as the National Firearms Act and their implications for gun owners and citizens of today. Suppressors, Short Barreled Rifles, Short Barreled Shotguns, Destructive Devices, Any Other Weapons, and Machine Guns are all welcome here.",140k,609,"Nov 29, 2010"
eagles,https://www.reddit.com/r/eagles/,"A place for Eagles fans to come together to discuss the team, latest news and rumors. Go Birds!",222k,785,"May 27, 2008"
sixers,https://www.reddit.com/r/sixers/,"Reddit home of the Philadelphia 76ers, one of the oldest and most storied franchises in the National Basketball Association.",215k,611,"Feb 28, 2011"
Browns,https://www.reddit.com/r/Browns/,Official subreddit of The Cleveland Browns,131k,1.2k,"Aug 20, 2010"
detroitlions,https://www.reddit.com/r/detroitlions/,"The official subreddit for Detroit Lions football.

[NFL, National Football League, NFC North, NFC Central, Black and Blue Division]",113k,319,"Jul 24, 2010"
discgolf,https://www.reddit.com/r/discgolf/,Welcome to discgolf,183k,2.1k,"Jul 16, 2008"
Cricket,https://www.reddit.com/r/Cricket/,"News, banter and occasional serious discussion on the great game.",355k,1.5k,"Mar 12, 2008"
MLS,https://www.reddit.com/r/MLS/,"Welcome to /r/MLS! This community is for supporters of any and all levels of soccer in the United States & Canada, with an emphasis on Major League Soccer.",316k,521,"Nov 3, 2009"
canucks,https://www.reddit.com/r/canucks/,*The* subreddit for fans of the Vancouver Canucks.,83.0k,549,"Jan 20, 2009"
bikewrench,https://www.reddit.com/r/bikewrench/,"A forum for folks with questions about bicycle repair.

Post your problems, and we will try to get your bike rolling again. It really helps if you can provide pictures and/or video.",137k,417,"Jun 3, 2011"
Nerf,https://www.reddit.com/r/Nerf/,"The premier community for enthusiasts of blasters of non-harmful projectiles (darts, straws, disks, balls, bands, water, or anything else) and the culture surrounding them.",70.1k,265,"May 26, 2009"
leafs,https://www.reddit.com/r/leafs/,"**The Toronto Maple Leafs subreddit, home to links and discussion of the Maple Leafs. Go Leafs Go!**",147k,460,"Sep 30, 2009"
DynastyFF,https://www.reddit.com/r/DynastyFF/,"🏈 NO Individual team questions. Review sub rules.
🏈 IDP league? Visit r/FFIDP.
🏈 Individual team help? Visit r/Fantasy_Football.",77.1k,953,"Jul 30, 2012"
minnesotavikings,https://www.reddit.com/r/minnesotavikings/,NO,147k,757,"Nov 9, 2008"
cowboys,https://www.reddit.com/r/cowboys/,Welcome to /r/cowboys! The official subreddit of the Dallas Cowboys,190k,522,"Dec 14, 2009"
